propertName,links,rating,society,price,area,areaWithType,bedRooms,bathRooms,additionalRooms,address,floorNum,facing,agePossesion,nearbyLocation,description,furnishDetails,features,propertyId,flatName,sector
"3 BHK Flatin Sector 56, Gurgaon",https://www.99acres.com/3-bhk-bedroom-apartment-flat-for-sale-in-samanvay-apartment-sector-56-gurgaon-2300-sq-ft-spid-K79773347,,  Samanvay Apartment,2.5,2300.0,2000.0,3 Bedrooms,4 Bathrooms,"Servant Room,Others","Samanvay Apartment Sector 56, Gurgaon",6th   of 6 Floors,North,10+ Year Old,Sector metro station Sector metro station Sector 54 chowk metro station Hong Kong Bazaar Mall Radhakrishna Shani Mandir Sanatan Dharm Mandir Icici bank ATM State bank ATM Icici bank ATM Citi bank ATM Indusind bank ATM Kriti Hospital Anand Hospital Gurgaon pracksht hospital Surgicare Hospital Gurgaon Arunodaya Deseret Eye Hospital Vatsalya Clinic HUDA Office Complex Medisca Apollo Pharmacy Intellion Park International Tech Park Heera Fuel Station HCG CNG Station Hdfc bank and atm Hdfc bank Kotak mahindra bank State bank of india Indusind bank Axis bank Icici bank Hdfc bank Hdfc bank & atm 222 Pizza Hut Wat-a-Burger Burger Singh Bikanerwala Naivedyam Restaurant Madison and Pike IILM Iilm University Sushant College of Arts & Architecture Ansal Institute of Technology Suncity School Gurugram University Unitech Business Park,"This lovely 3 bhk apartment/flat in sector 56 gurgaon is available for sale in one of gurgaon's most popular projects, samanvay apartment. The flat is facing the north direction. Containing 3 bedroom(s), 4 bathrooms and 3 balconies, this flat is spread over a super built up area of 2300 sq.Ft. This ...","['3 Wardrobe', '7 Fan', '1 Exhaust Fan', '3 Geyser', '12 Light', '1 Modular Kitchen', '1 Chimney', 'No AC', 'No Bed', 'No Curtains', 'No Dining Table', 'No Microwave', 'No Fridge', 'No Sofa', 'No Stove', 'No TV', 'No Washing Machine', 'No Water Purifier']",Security  Fire Alarm Feng Shui  Vaastu Compliant Private Garden  Terrace Intercom Facility Lift High Ceiling Height Maintenance Staff Water Storage Piped-gas Visitor Parking Park Security Personnel Natural Light Internetwi-fi connectivity Airy Rooms Waste Disposal Rain Water Harvesting Club house  Community Center Water softening plant,K79773347,"3 BHK flat in  Samanvay Apartment ,  Sector 56",56
"4 BHK Flatin Sector 67, Gurgaon",https://www.99acres.com/4-bhk-bedroom-apartment-flat-for-sale-in-ireo-victory-valley-sector-67-gurgaon-2830-sq-ft-spid-G78765217,4.0,  Ireo Victory Valley,5.85,2830.0,,4 Bedrooms,4 Bathrooms,Servant Room,"Ireo Victory Valley Sector 67, Gurgaon",4th   of 51 Floors,South-West,5 to 10 Year Old,AIPL Joy Street Mall Golf Course Extension Road Alpine Convent School DPG Institute of Technology CK Birla Hospital Indira Gandhi International Airport iON Digital Zone (Gurugram) Radisson Hotel Sohna Road SkyJumper Trampoline Park HUDA Mini Golf Course PVR Drive in Theatre,"This apartment on sale has exclusive view of the complex and it has 4 bedroom and 3 attached bathroom and one common bathroom. There is one utility area and staff quarter.
 Additional details :Piped gas facility is available in the property.
The apartment has borings water supply.
Daily needs shop...","['3 Wardrobe', '1 Water Purifier', '6 Fan', '1 Exhaust Fan', '4 Geyser', '1 Stove', '10 Light', '6 AC', '1 Modular Kitchen', '1 Chimney', 'No Bed', 'No Curtains', 'No Dining Table', 'No Microwave', 'No Fridge', 'No Sofa', 'No TV', 'No Washing Machine']",Centrally Air Conditioned Water purifier Security  Fire Alarm Feng Shui  Vaastu Compliant Intercom Facility Lift High Ceiling Height Maintenance Staff Water Storage Separate entry for servant room No open drainage around Piped-gas Internetwi-fi connectivity Visitor Parking Swimming Pool Park Security Personnel Natural Light Airy Rooms Spacious Interiors Low Density Society Waste Disposal Rain Water Harvesting Water softening plant Shopping Centre Fitness Centre  GYM Club house  Community Center,G78765217,"4 BHK flat in  Ireo Victory Valley ,  Sector 67",67
"3 BHK Flatin Sector 63A, Gurgaon",https://www.99acres.com/3-bhk-bedroom-apartment-flat-for-sale-in-anant-raj-estates-sector-63a-gurgaon-3000-sq-ft-spid-D79744909,,  Anant Raj Estates,4.1,,3000.0,3 Bedrooms,3 Bathrooms,Servant Room,"Anant Raj Estates Sector 63A, Gurgaon",3rd   of 3 Floors,East,1 to 5 Year Old,Sector 55-56 Metro Station WorldMark Gurgaon Sohna Road (NH 248A) DPS International Edge Sushant University Marengo Asia Hospitals Indira Gandhi International Airport Gurgaon Railway Station Vatika Business Centre De Adventure Park Albatross Golf Course Club House,"Located in the popular residential address of sector 63a gurgaon, anant raj estates is one of the most preferred destination for apartments in gurgaon. This 3 bhk flat is your ticket to be a part of this community. This is a east-Facing property. Containing 3 bedroom(s), 3 bathrooms and 2 balconies,...","['3 Fan', '3 Geyser', '3 Light', '5 AC', '1 Modular Kitchen', 'No Bed', 'No Chimney', 'No Curtains', 'No Dining Table', 'No Exhaust Fan', 'No Microwave', 'No Fridge', 'No Sofa', 'No Stove', 'No TV', 'No Wardrobe', 'No Washing Machine', 'No Water Purifier']",Security  Fire Alarm Feng Shui  Vaastu Compliant Intercom Facility Lift Maintenance Staff Water Storage Visitor Parking Swimming Pool Park Shopping Centre Fitness Centre  GYM Rain Water Harvesting Club house  Community Center,D79744909,"3 BHK flat in  Anant Raj Estates ,  Sector 63A",63
"3 BHK Flatin Sector 109, Gurgaon",https://www.99acres.com/3-bhk-bedroom-apartment-flat-for-sale-in-chintels-serenity-sector-109-gurgaon-2100-sq-ft-spid-B77048049,3.7,  Chtels Serenity,3.0,2100.0,1731.5,3 Bedrooms,4 Bathrooms,Servant Room,"Chintels Serenity Sector 109, Gurgaon",12nd   of 20 Floors,North-East,1 to 5 Year Old,"Iffco Chowk Metro Station Ambience Mall Dwarka Expressway GEMS International School Manipal Hospital Indira Gandhi International Airport The Club, International City (Swim club) Gurgaon Railway Station Fun N Food Village BSF Golf Course","This 3 bhk flat is located in chintels serenity, which houses some of the most spacious flats in sector 109 gurgaon. This residential flat is north-East-Facing direction. Constructed on a super built up area of 2100 sq.Ft., the flat comprises 3 bedroom(s), 4 bathrooms and 3 balconies. The property i...","['1 Stove', '1 Modular Kitchen', '5 AC', '1 Chimney', 'No Bed', 'No Curtains', 'No Dining Table', 'No Exhaust Fan', 'No Fan', 'No Geyser', 'No Light', 'No Microwave', 'No Fridge', 'No Sofa', 'No TV', 'No Wardrobe', 'No Washing Machine', 'No Water Purifier']",Security  Fire Alarm Power Back-up Feng Shui  Vaastu Compliant Intercom Facility Lift High Ceiling Height Maintenance Staff Water Storage Separate entry for servant room No open drainage around Piped-gas Visitor Parking Swimming Pool Park Security Personnel Natural Light Airy Rooms Spacious Interiors Low Density Society Waste Disposal Rain Water Harvesting Water softening plant Shopping Centre Fitness Centre  GYM Club house  Community Center,B77048049,"3 BHK flat in  Chtels Serenity ,  Sector 109",109
"3 BHK Flatin Sector 81, Gurgaon",https://www.99acres.com/3-bhk-bedroom-apartment-flat-for-sale-in-vipul-lavanya-sector-81-gurgaon-1560-sq-ft-spid-M79628849,3.8,  Vipul Lavanya,1.4,1560.0,1020.0,3 Bedrooms,3 Bathrooms,,"Vipul Lavanya Sector 81, Gurgaon",6th   of 14 Floors,East,5 to 10 Year Old,Millennium City Centre Gurugram Town Square 2 Manesar Road Sh. S. N. Sidheshwar Sr. Sec. Public Singhania University Fortis Hospital Indira Gandhi International Airport Garhi Harsaru Junction Unitech Business Park Kaara AapnoGhar Manesar Golf Course Nakhrola Stadium,"Park facing flat nice layout good condition all facility club house south facing basement parking
 Additional details :Piped gas facility is available in the property.
The apartment has borings water supply.
Daily needs shopping could be done within the society premises to make the stay convinent....","['3 Wardrobe', '5 Fan', '1 Exhaust Fan', '2 Geyser', '15 Light', '1 Curtains', '1 Chimney', '1 Modular Kitchen', 'No AC', 'No Bed', 'No Dining Table', 'No Microwave', 'No Fridge', 'No Sofa', 'No Stove', 'No TV', 'No Washing Machine', 'No Water Purifier']",Power Back-up Feng Shui  Vaastu Compliant Security  Fire Alarm Intercom Facility Lift Swimming Pool Maintenance Staff Water Storage Park Visitor Parking Fitness Centre  GYM Club house  Community Center,M79628849,"3 BHK flat in  Vipul Lavanya ,  Sector 81",81
"4 BHK Flatin Sector 102, Gurgaon",https://www.99acres.com/4-bhk-bedroom-apartment-flat-for-sale-in-adani-m2k-oyster-grande-sector-102-gurgaon-3198-sq-ft-spid-P79093949,3.9,  Adani M2K Oyster Grande,3.75,3198.0,,4 Bedrooms,4 Bathrooms,,"Adani M2K Oyster Grande Sector 102, Gurgaon",10th   of 27 Floors,East,1 to 5 Year Old,The Esplanade Mall Dwarka Express Highway Delhi Public School SGT University The Signature Hospital Indira Gandhi Airport Gurugram Railway Station Nehru Stadium,"Looking for a 4 bhk property for sale in gurgaon? Buy this 4 bhk flat in adani m2k oyster grande that is situated in sector 102 gurgaon. This is a east-Facing property. The flat occupies a super built up area of 3198 sq.Ft. That consists of 4 bedrooms, 4 bathrooms and 3 balconies. This flat is situa...","['4 Wardrobe', '4 Bed', '5 Fan', '1 Exhaust Fan', '4 Geyser', '5 Light', '4 TV', '4 AC', '1 Modular Kitchen', 'No Chimney', 'No Curtains', 'No Dining Table', 'No Microwave', 'No Fridge', 'No Sofa', 'No Stove', 'No Washing Machine', 'No Water Purifier']",Security  Fire Alarm Power Back-up Feng Shui  Vaastu Compliant Intercom Facility Lift High Ceiling Height Maintenance Staff Water Storage Separate entry for servant room No open drainage around Piped-gas Visitor Parking Swimming Pool Park Security Personnel Natural Light Airy Rooms Spacious Interiors Shopping Centre Fitness Centre  GYM Waste Disposal Rain Water Harvesting Club house  Community Center Water softening plant,P79093949,"4 BHK flat in  Adani M2K Oyster Grande ,  Sector 102",102
"3 BHK Flatin Sector 83, Gurgaon",https://www.99acres.com/3-bhk-bedroom-apartment-flat-for-sale-in-mapsko-paradise-sector-83-gurgaon-1340-sq-ft-r2-spid-E41501703,3.9,  Mapsko Paradise,1.35,1340.0,,3 Bedrooms,3 Bathrooms,Others,"Mapsko Paradise Sector 83, Gurgaon",3rd   of 12 Floors,North-West,1 to 5 Year Old,Millennium City Centre Gurugram Raheja Mall NH 48 Vivekanand school Gurugram Univ Kankrola Sec 87 Genesis Hospital Indira Gandhi Intl Airport Patli Railway Station Hans Business Park Hyatt Regency Gurugram De Adventure Park - farms Golden Greens Golf & Resorts Ltd Nakhrola Stadium,"Direct and confirm units available. Growth realtech. Keys in hand. For more info. Pls visit @ site address : Ab2-104, mapsko casa bella
 
 Additional details :Daily needs shopping could be done within the society premises to make the stay convinent.
Full power backup is available.
The society has ...","['4 Fan', '1 Exhaust Fan', '2 Geyser', '1 Stove', '6 Light', '1 AC', '1 Modular Kitchen', '1 Chimney', '1 Curtains', '4 Wardrobe', '1 Microwave', 'No Bed', 'No Dining Table', 'No Fridge', 'No Sofa', 'No TV', 'No Washing Machine', 'No Water Purifier']",Feng Shui  Vaastu Compliant Security  Fire Alarm Intercom Facility Lift Maintenance Staff Swimming Pool Water Storage Park Visitor Parking Fitness Centre  GYM Club house  Community Center,E41501703,"3 BHK flat in  Mapsko Paradise ,  Sector 83",83
"3 BHK Flatin Sector 56, Gurgaon",https://www.99acres.com/3-bhk-bedroom-apartment-flat-for-sale-in-sukhshanti-apartment-sector-56-gurgaon-1900-sq-ft-spid-Z79626525,,  Sukhshanti Apartment,2.3,1900.0,1800.0,3 Bedrooms,3 Bathrooms,Others,"Sukhshanti Apartment Sector 56, Gurgaon",2nd   of 9 Floors,South,5 to 10 Year Old,Sector metro station Sector metro station Sector 54 chowk metro station Hong Kong Bazaar Mall Sanatan Dharm Mandir Radhakrishna Shani Mandir Icici bank ATM State bank ATM Icici bank ATM Citi bank ATM Indusind bank ATM pracksht hospital Kriti Hospital Surgicare Hospital Gurgaon Anand Hospital Gurgaon Arunodaya Deseret Eye Hospital HUDA Office Complex Medisca Apollo Pharmacy Intellion Park International Tech Park HCG CNG Station Heera Fuel Station Hdfc bank and atm State bank of india Kotak mahindra bank Indusind bank Axis bank Hdfc bank Icici bank Hdfc bank & atm Hdfc bank 222 Pizza Hut Wat-a-Burger Burger Singh Bikanerwala Naivedyam Restaurant Clock tower IILM Iilm University Sushant College of Arts & Architecture Ansal Institute of Technology Suncity School Unitech Business Park,"Looking for a 3 bhk property for sale in gurgaon? Buy this 3 bhk flat in sukhshanti apartment that is situated in sector 56 gurgaon. This is a south-Facing property. Containing 3 bedroom(s), 3 bathrooms and more than 3 balconies, this flat is spread over a super built up area of 1900 sq.Ft. The prop...","['4 Wardrobe', '5 Fan', '1 Exhaust Fan', '3 Geyser', '21 Light', '1 Chimney', '1 Modular Kitchen', 'No AC', 'No Bed', 'No Curtains', 'No Dining Table', 'No Microwave', 'No Fridge', 'No Sofa', 'No Stove', 'No TV', 'No Washing Machine', 'No Water Purifier']",Security  Fire Alarm Power Back-up Feng Shui  Vaastu Compliant Intercom Facility Lift High Ceiling Height Maintenance Staff Water Storage No open drainage around Bank Attached Property Piped-gas Visitor Parking Park Security Personnel Natural Light Internetwi-fi connectivity Airy Rooms Spacious Interiors Low Density Society Waste Disposal Rain Water Harvesting Water softening plant,Z79626525,"3 BHK flat in  Sukhshanti Apartment ,  Sector 56",56
"3 BHK Flatin Sector 66, Gurgaon",https://www.99acres.com/3-bhk-bedroom-apartment-flat-for-sale-in-ireo-uptown-sector-66-gurgaon-1872-sq-ft-r14-spid-D48294473,4.2,  Ireo Uptown,3.1,1872.0,1870.0,3 Bedrooms,4 Bathrooms,"Servant Room,Others","Ireo Uptown Sector 66, Gurgaon",14th   of 23 Floors,North-West,5 to 10 Year Old,Hub 66 Shiksha Bharti Public School VIBGYOR High School Gyan Bharti Public School Diamond Public School Mother land public school Govind Hospital Kamal Hospital HDFC Bank Axis Bank Keshav Pharmacy Apollo Pharmacy Creative Tennis Academy Shanti Tennis Academy Lotus Sports Academy,"A 3 bedroom resale flat, located in sector-66, gurgaon, is available. It is a ready to move in semi-Furnished flat located in ireo uptown. Situated in a prominent locality, it is a 1-5 year old, which is in its prime condition. The flat is on the 14th floor of the building. Aesthetically designed, t...","['5 Fan', '1 Exhaust Fan', '4 Geyser', '1 Stove', '14 Light', '5 AC', '1 Modular Kitchen', '1 Chimney', 'No Bed', 'No Curtains', 'No Dining Table', 'No Microwave', 'No Fridge', 'No Sofa', 'No TV', 'No Wardrobe', 'No Washing Machine', 'No Water Purifier']",Feng Shui  Vaastu Compliant Intercom Facility Lift Centrally Air Conditioned High Ceiling Height Maintenance Staff Water Storage Bank Attached Property Piped-gas Visitor Parking Swimming Pool Park Security Personnel Natural Light Internetwi-fi connectivity Low Density Society Fitness Centre  GYM Rain Water Harvesting Club house  Community Center,D48294473,"3 BHK flat in  Ireo Uptown ,  Sector 66",66
"4 BHK Flatin Sector 49, Gurgaon",https://www.99acres.com/4-bhk-bedroom-apartment-flat-for-sale-in-orchid-petals-sector-49-gurgaon-2562-sq-ft-spid-P80274551,4.1,  Orchid Petals,4.25,2562.0,2500.0,4 Bedrooms,5 Bathrooms,"Others,Study Room,Servant Room","Orchid Petals Sector 49, Gurgaon",1st   of 14 Floors,East,1 to 5 Year Old,Sapphire Mall Omaxe City Centre BigBazaar Sohna Rd Kinder Care Playschool Kangaroo Kids Preschool shiv Mandir Polaris Hospital Medanta Hospital Artemis Hospital HDFC Bank Radisson Hotel SRS Cinemas,"Check out this 4 bhk apartment for sale in orchid petals, a popular residential project that houses in-Demand flats in sector 49 gurgaon. This property faces the east direction. The floor plan additionally contains 4 bedroom(s), 5 bathrooms and 3 balconies. All in all, the flat is spread over a supe...","['1 Water Purifier', '1 Fridge', '9 Fan', '1 Exhaust Fan', '1 Dining Table', '4 Geyser', '1 Stove', '14 Light', '1 Curtains', '1 Modular Kitchen', '1 TV', '1 Chimney', '5 AC', '4 Bed', '4 Wardrobe', '1 Sofa', '1 Washing Machine', '1 Microwave']",Centrally Air Conditioned Water purifier Security  Fire Alarm Power Back-up Feng Shui  Vaastu Compliant Private Garden  Terrace Intercom Facility Lift High Ceiling Height Maintenance Staff False Ceiling Lighting Water Storage Separate entry for servant room No open drainage around Bank Attached Property Piped-gas Internetwi-fi connectivity Recently Renovated Visitor Parking Swimming Pool Park Security Personnel Natural Light Airy Rooms Spacious Interiors Low Density Society Waste Disposal Rain Water Harvesting Water softening plant Shopping Centre Fitness Centre  GYM Club house  Community Center,P80274551,"4 BHK flat in  Orchid Petals ,  Sector 49",49
"4 BHK Flatin Sector 66, Gurgaon",https://www.99acres.com/4-bhk-bedroom-apartment-flat-for-sale-in-ireo-uptown-sector-66-gurgaon-2052-sq-ft-r11-spid-Q46349643,4.2,  Ireo Uptown,3.6,2052.0,2010.0,4 Bedrooms,4 Bathrooms,Servant Room,"Ireo Uptown Sector 66, Gurgaon",Ground of 25 Floors,North-West,5 to 10 Year Old,Hub 66 Shiksha Bharti Public School VIBGYOR High School Gyan Bharti Public School Diamond Public School Mother land public school Govind Hospital Kamal Hospital HDFC Bank Axis Bank Keshav Pharmacy Apollo Pharmacy Creative Tennis Academy Shanti Tennis Academy Lotus Sports Academy,"Ireo uptown is a beautiful society.A 4 bedroom resale flat, located in sector-66, gurgaon, is available. It is a ready to move in semifurnished flat located in ireo uptown. Situated in a prominent locality, it is a 5-10 year old property, which is in its prime condition. The flat is on the ground fl...","['4 Wardrobe', '6 Fan', '1 Exhaust Fan', '4 Geyser', '1 Stove', '16 Light', '6 AC', '1 Modular Kitchen', '1 Chimney', 'No Bed', 'No Curtains', 'No Dining Table', 'No Microwave', 'No Fridge', 'No Sofa', 'No TV', 'No Washing Machine', 'No Water Purifier']",Security  Fire Alarm Feng Shui  Vaastu Compliant Intercom Facility Lift High Ceiling Height Maintenance Staff Water Storage Bank Attached Property Piped-gas Visitor Parking Swimming Pool Park Natural Light Internetwi-fi connectivity Low Density Society Shopping Centre Fitness Centre  GYM Rain Water Harvesting Club house  Community Center Water softening plant,Q46349643,"4 BHK flat in  Ireo Uptown ,  Sector 66",66
"4 BHK Flatin Sector 90, Gurgaon",https://www.99acres.com/4-bhk-bedroom-apartment-flat-for-sale-in-dlf-new-town-heights-1-sector-90-gurgaon-2727-sq-ft-r1-spid-Z77991925,4.0,  DLF New Town Heights 1,2.75,2727.0,2450.0,4 Bedrooms,4 Bathrooms,"Servant Room,Pooja Room","DLF New Town Heights 1 Sector 90, Gurgaon",10th   of 19 Floors,South,5 to 10 Year Old,Manish Gallexie 91 NH-8 IMT Manesar RHM Public School Silver Streak Multi Speciality Hospital Airport Holiday Inn Gurugram,"Looking for a 4 bhk property for sale in gurgaon? Buy this 4 bhk flat in dlf new town heights 1 that is situated in sector 90 gurgaon. This property faces the south direction. The flat is over 2727 sq.Ft. Super built up area and comes with 4 bedroom(s), 4 bathrooms and more than 3 balconies. The fla...","['6 Fan', '12 Light', '5 AC', 'No Bed', 'No Chimney', 'No Curtains', 'No Dining Table', 'No Exhaust Fan', 'No Geyser', 'No Modular Kitchen', 'No Microwave', 'No Fridge', 'No Sofa', 'No Stove', 'No TV', 'No Wardrobe', 'No Washing Machine', 'No Water Purifier']",Centrally Air Conditioned Water purifier Security  Fire Alarm Power Back-up Feng Shui  Vaastu Compliant Private Garden  Terrace Intercom Facility Lift High Ceiling Height Maintenance Staff False Ceiling Lighting Water Storage Separate entry for servant room No open drainage around Bank Attached Property Piped-gas Internetwi-fi connectivity Recently Renovated Visitor Parking Swimming Pool Park Security Personnel Natural Light Airy Rooms Spacious Interiors Low Density Society Waste Disposal Rain Water Harvesting Water softening plant Shopping Centre Fitness Centre  GYM Club house  Community Center,Z77991925,"4 BHK flat in  DLF New Town Heights 1 ,  Sector 90",90
"3 BHK Flatin Sector 70, Gurgaon",https://www.99acres.com/3-bhk-bedroom-apartment-flat-for-sale-in-shree-vardhman-victoria-sector-70-gurgaon-1950-sq-ft-spid-L80100561,3.5,  Shree Vardhman Victoria,2.55,1950.0,,3 Bedrooms,4 Bathrooms,Study Room,"Shree Vardhman Victoria Sector 70, Gurgaon",7th   of 18 Floors,North-East,1 to 5 Year Old,"Airia Mall Golf Course Extn Road Sohna Road Southern Peripheral Rd, Gurugram Kunskapsskolan International Ektaa Hospitals  Main Sohna Rd Sanjeevani Hospital - Child Specialist Federal Bank Sector 71 Central Bank Of India Sohna Rd Axis Bank, Sohna Rd Spaze Palazo, Golf Course Ext Rd VATIKA BUSINESS PARK Sohna Rd The Medicity, Spaze iTech Park Tulip Violet Society, Sector 69 IndianOil, Hasanpur","Shree vardhman victoria sector 70 has 10 towers, with 18 floors each and 592 units on offer. *spread over an area of 10.97 acres, shree vardhman victoria sector 70, gurgaon is one of the spacious housing societies in the gurgaon region.","['1 Water Purifier', '3 Fan', '1 Exhaust Fan', '4 Geyser', '8 Light', '4 AC', '1 TV', '1 Modular Kitchen', '1 Chimney', '1 Curtains', '2 Bed', '3 Wardrobe', 'No Dining Table', 'No Microwave', 'No Fridge', 'No Sofa', 'No Stove', 'No Washing Machine']",Power Back-up Feng Shui  Vaastu Compliant Security  Fire Alarm Intercom Facility Lift Swimming Pool Maintenance Staff Park Visitor Parking Shopping Centre Fitness Centre  GYM Club house  Community Center,L80100561,"3 BHK flat in  Shree Vardhman Victoria ,  Sector 70",70
"4 BHK Flatin Sector 62, Gurgaon",https://www.99acres.com/4-bhk-bedroom-apartment-flat-for-sale-in-conscient-heritage-one-sector-62-gurgaon-2626-sq-ft-spid-H80246357,,  Conscient Heritage One,5.3,,2626.0,4 Bedrooms,4 Bathrooms,Servant Room,"Conscient Heritage One Sector 62, Gurgaon",Ground of 25 Floors,,5 to 10 Year Old,Hong Kong Bazaar Mall Radhakrishna Shani Mandir Sanatan Dharm Mandir Icici bank ATM State bank ATM pracksht hospital Kriti Hospital Vatsalya Clinic Anand Hospital Gurgaon Surgicare Hospital Gurgaon HUDA Office Complex Medisca International Tech Park SPAZE BUSINESS PARK Intellion Park Hdfc bank Hdfc bank and atm Pizza Hut Madison and Pike Unitech Business Park,"Multiple sports facilities including floodlit multipurpose playground, indoor badminton court, indoor squash court, joggers trail, resort style large swimming pool
15000 sq. Ft clubhouse for 300 families","['4 Wardrobe', '5 Geyser', '10 Light', '4 AC', 'No Bed', 'No Chimney', 'No Curtains', 'No Dining Table', 'No Exhaust Fan', 'No Fan', 'No Modular Kitchen', 'No Microwave', 'No Fridge', 'No Sofa', 'No Stove', 'No TV', 'No Washing Machine', 'No Water Purifier']",Power Back-up Intercom Facility Lift Swimming Pool Park Shopping Centre Fitness Centre  GYM Club house  Community Center Rain Water Harvesting,H80246357,"4 BHK flat in  Conscient Heritage One ,  Sector 62",62
"2 BHK Flatin Sector 70A, Gurgaon",https://www.99acres.com/2-bhk-bedroom-apartment-flat-for-sale-in-pyramid-urban-homes-sector-70a-gurgaon-836-sq-ft-spid-B80739649,4.0,  Pyramid Urban Homes,0.72,836.0,525.0,2 Bedrooms,2 Bathrooms,,"Pyramid Urban Homes Sector 70A, Gurgaon",7th   of 14 Floors,North,1 to 5 Year Old,"Airia Mall Sohna Road St. Angel's Global, Sector 70 A Sparsh Hospital Indira Gandhi International Airport Universal Business Park Lemon Tree Hotel, Sohna Road De Adventure Park SkyJumper Trampoline Park","Pyramid urban homes sector 70 a 2 bhk ka flat is available
 Additional details :Piped gas facility is available in the property.
The apartment has borings water supply.
Daily needs shopping could be done within the society premises to make the stay convinent.
Full power backup is available.
There ...","['2 Wardrobe', '3 Fan', '2 Geyser', '5 Light', '1 Modular Kitchen', '1 Curtains', 'No AC', 'No Bed', 'No Chimney', 'No Dining Table', 'No Exhaust Fan', 'No Microwave', 'No Fridge', 'No Sofa', 'No Stove', 'No TV', 'No Washing Machine', 'No Water Purifier']",Security  Fire Alarm Feng Shui  Vaastu Compliant Intercom Facility Lift Maintenance Staff Water Storage Piped-gas Visitor Parking Swimming Pool Park Security Personnel Shopping Centre Fitness Centre  GYM Rain Water Harvesting Club house  Community Center,B80739649,"2 BHK flat in  Pyramid Urban Homes ,  Sector 70A",70
