propertName,links,rating,society,price,area,areaWithType,bedRooms,bathRooms,additionalRooms,address,floorNum,facing,agePossesion,nearbyLocation,description,furnishDetails,features,propertyId,flatName,sector
"2 BHK Flatin Sector 37D, Gurgaon",https://www.99acres.com/2-bhk-bedroom-apartment-flat-for-sale-in-ramprastha-the-edge-towers-sector-37d-gurgaon-1380-sq-ft-r20-spid-I38259737,3.5,  Ramprastha The Edge Towers,1.08,1380.0,1310.0,2 Bedrooms,2 Bathrooms,Others,"Ramprastha The Edge Towers Sector 37D, Gurgaon",10th   of 19 Floors,South-East,1 to 5 Year Old,The Esplanade Mall Dwarka Express Euro International School Narayana Junior College Yashroop Hospital Indira Gandhi International Airport Gurugram Railway Station Aboard Offices Complex Holiday Inn Hotel,"2 bhk available for sale immediate , ready to move , available for limited time period . 
Price all inclusive . This is a meticulously designed 2 bhk resale apartment located in sector-37d, gurgaon. It is a freehold property. The flat is a spacious property and is ready to move in. Located in an int...","['2 Wardrobe', '2 Fan', '1 Geyser', '6 Light', 'No AC', 'No Bed', 'No Chimney', 'No Curtains', 'No Dining Table', 'No Exhaust Fan', 'No Modular Kitchen', 'No Microwave', 'No Fridge', 'No Sofa', 'No Stove', 'No TV', 'No Washing Machine', 'No Water Purifier']",Feng Shui  Vaastu Compliant Security  Fire Alarm Intercom Facility Lift Maintenance Staff Swimming Pool Water Storage Park Visitor Parking Shopping Centre Fitness Centre  GYM Club house  Community Center,I38259737,"2 BHK flat in  Ramprastha The Edge Towers ,  Sector 37D",37
"3 BHK Flatin Sector 65, Gurgaon",https://www.99acres.com/3-bhk-bedroom-apartment-flat-for-sale-in-m3m-skycity-sector-65-gurgaon-2054-sq-ft-spid-C78899177,3.8,  M3M Skycity,3.81,2054.0,,3 Bedrooms,3 Bathrooms,Servant Room,"M3M Skycity Sector 65, Gurgaon",21st   of 47 Floors,East,0 to 1 Year Old,Millennium City Centre Metro Station Airia Mall Golf Course Ext Rd Gurgaon Faridabad Highway St. Xavier's High School Gurugram University Park Hospital Indira Gandhi International Airport Gurugram Station Intellion Edge Ramada by Wyndham MadhavGarh Farms DLF Golf and Country Club,"Looking for a 3 bhk property for sale in gurgaon? Buy this 3 bhk flat in m3m skycity that is situated in sector 65 gurgaon. This property faces the east direction. The flat is over 2054 sq.Ft. Super built up area and comes with 3 bedroom(s), 3 bathrooms and 3 balconies. The residential building has ...","['1 Water Purifier', '6 Fan', '1 Fridge', '1 Exhaust Fan', '4 Geyser', '15 Light', '5 AC', '1 Modular Kitchen', '1 Chimney', '4 Wardrobe', '1 Washing Machine', '1 Microwave', 'No Bed', 'No Curtains', 'No Dining Table', 'No Sofa', 'No Stove', 'No TV']",Centrally Air Conditioned Water purifier Security  Fire Alarm Feng Shui  Vaastu Compliant Intercom Facility Lift High Ceiling Height Maintenance Staff False Ceiling Lighting Water Storage Separate entry for servant room No open drainage around Piped-gas Internetwi-fi connectivity Visitor Parking Swimming Pool Park Security Personnel Natural Light Airy Rooms Spacious Interiors Low Density Society Waste Disposal Rain Water Harvesting Water softening plant Shopping Centre Fitness Centre  GYM Club house  Community Center,C78899177,"3 BHK flat in  M3M Skycity ,  Sector 65",65
"4 BHK Flatin Sector 65, Gurgaon",https://www.99acres.com/4-bhk-bedroom-apartment-flat-for-sale-in-emaar-emerald-hills-sector-65-gurgaon-3600-sq-ft-spid-J80319945,4.1,  Emaar Emerald Hills,6.99,3600.0,,4 Bedrooms,4 Bathrooms,"Servant Room,Study Room","Emaar Emerald Hills Sector 65, Gurgaon",3rd   of 4 Floors,West,1 to 5 Year Old,"Iffco Chowk M3M Cosmopolitan Sohna Gurgaon Road Pragyanam School Gurugram University CK Birla Hospital, Gurgaon Indira Gandhi Intl Airport Patli Railway Station Intl Tech Park Gurgaon Holiday Inn Express AapnoGhar Teri Golf Course Tau DeviLal Sports Complex","This beautiful 4 bhk flat in sector 65 gurgaon is situated in emaar emerald hills, one of the popular residential society in gurgaon. The flat is west-Facing. The floor plan additionally contains 4 bedroom(s), 4 bathrooms and more than 3 balconies. All in all, the flat is spread over a super built u...","['1 Water Purifier', '2 Fan', '1 Fridge', '1 Exhaust Fan', '1 Dining Table', '3 Geyser', '1 Stove', '2 Light', '3 AC', '2 TV', '1 Modular Kitchen', '1 Chimney', '1 Curtains', '1 Bed', '2 Wardrobe', '1 Sofa', '1 Washing Machine', '1 Microwave']",Centrally Air Conditioned Water purifier Security  Fire Alarm Feng Shui  Vaastu Compliant Private Garden  Terrace Intercom Facility Lift High Ceiling Height Maintenance Staff False Ceiling Lighting Water Storage Separate entry for servant room Bank Attached Property Piped-gas Internetwi-fi connectivity Recently Renovated Visitor Parking Swimming Pool Park Security Personnel Natural Light Airy Rooms Spacious Interiors Low Density Society Waste Disposal Rain Water Harvesting Water softening plant Shopping Centre Fitness Centre  GYM Club house  Community Center,J80319945,"4 BHK flat in  Emaar Emerald Hills ,  Sector 65",65
"2 BHK Flatin Sector 102, Gurgaon",https://www.99acres.com/2-bhk-bedroom-apartment-flat-for-sale-in-shapoorji-pallonji-joyville-gurugram-sector-102-gurgaon-1368-sq-ft-spid-J79095201,3.9,  Shapoorji Pallonji Joyville Gurugram,1.91,1368.0,,2 Bedrooms,2 Bathrooms,,"Shapoorji Pallonji Joyville Gurugram Sector 102, Gurgaon",15th   of 26 Floors,North-East,0 to 1 Year Old,IFFCO Chowk Metro Station The Esplanade Mall by DHOOT GROUP Dwarka Expressway Euro International School The NorthCap University Vibrant Hospital Indira Gandhi International Airport Basai Dhankot Railway Station Hyatt Place Gurgaon Udyog Vihar,"Shapoorji pallonji joyville gurugram is one of the most popular destination for buying apartments/ flats in sector 102 gurgaon. You too can be a part of this society by purchasing this 2 bhk flat here. This property faces the north-East direction. The floor plan additionally contains 2 bedroom(s), 2...","['3 Wardrobe', '1 Exhaust Fan', '1 Modular Kitchen', '1 Chimney', '5 AC', 'No Bed', 'No Curtains', 'No Dining Table', 'No Fan', 'No Geyser', 'No Light', 'No Microwave', 'No Fridge', 'No Sofa', 'No Stove', 'No TV', 'No Washing Machine', 'No Water Purifier']",Water purifier Centrally Air Conditioned Security  Fire Alarm Feng Shui  Vaastu Compliant Private Garden  Terrace Intercom Facility Lift High Ceiling Height Maintenance Staff False Ceiling Lighting Water Storage Separate entry for servant room No open drainage around Bank Attached Property Piped-gas Internetwi-fi connectivity Recently Renovated Visitor Parking Swimming Pool Park Security Personnel Natural Light Airy Rooms Spacious Interiors Low Density Society Waste Disposal Rain Water Harvesting Water softening plant Shopping Centre Fitness Centre  GYM Club house  Community Center,J79095201,"2 BHK flat in  Shapoorji Pallonji Joyville Gurugram ,  Sector 102",102
"3 BHK Flatin Sector 3, Gurgaon",https://www.99acres.com/3-bhk-bedroom-apartment-flat-for-sale-in-godrej-habitat-sector-3-gurgaon-2078-sq-ft-r6-spid-M71725968,,  Godrej Habitat,1.81,2078.0,2077.0,3 Bedrooms,3 Bathrooms,Servant Room,"Godrej Habitat Sector 3, Gurgaon",10th   of 17 Floors,North-East,0 to 1 Year Old,Huda City Centre Metro Station Star Mall Dwarka Expressway National Highway 8 Gems International School ICFAI University Sneh Hospital Indira Gandhi International Airport Country Inn & Suites by Radisson Appu Ghar Water Park HUDA Mini Golf Course,"This 3 bhk flat is located in godrej habitat, which houses some of the most spacious flats in sector 3 gurgaon. The floor plan additionally contains 3 bedroom(s), 3 bathrooms and 3 balconies. All in all, the flat is spread over a super built up area of 2078 sq.Ft. The property is located on the 10th...","['1 AC', 'No Bed', 'No Chimney', 'No Curtains', 'No Dining Table', 'No Exhaust Fan', 'No Fan', 'No Geyser', 'No Modular Kitchen', 'No Light', 'No Microwave', 'No Fridge', 'No Sofa', 'No Stove', 'No TV', 'No Wardrobe', 'No Washing Machine', 'No Water Purifier']",Power Back-up Feng Shui  Vaastu Compliant Intercom Facility Lift Swimming Pool Park Piped-gas Fitness Centre  GYM Club house  Community Center,M71725968,"3 BHK flat in  Godrej Habitat ,  Sector 3",3
"3 BHK Flatin Sector 99, Gurgaon",https://www.99acres.com/3-bhk-bedroom-apartment-flat-for-sale-in-pareena-express-heights-sector-99-gurgaon-1970-sq-ft-spid-F79872191,4.1,  Pareena Express Heights,1.9,1970.0,,3 Bedrooms,4 Bathrooms,Servant Room,"Pareena Express Heights Sector 99, Gurgaon",10th   of 14 Floors,North-East,1 to 5 Year Old,"Ocus Medley Dwarka Expy, Sector 88 Euro Intl School, Sector 37D, Gurugram Basant Valley School SGT University Vibrant Hospital Indira Gandhi Intl Airport Haier appliances India Pvt LTD","Pareena express heights is one of gurgaon's most sought after destination for apartments and this 3 bhk flat in sector 99 gurgaon is your opportunity to be a part of this community. This residential flat is north-East-Facing direction. Constructed on a super built up area of 1970 sq.Ft., the flat co...","['3 Wardrobe', '4 Fan', '1 Exhaust Fan', '2 Geyser', '5 Light', '2 AC', '1 Modular Kitchen', '1 Chimney', '1 Curtains', 'No Bed', 'No Dining Table', 'No Microwave', 'No Fridge', 'No Sofa', 'No Stove', 'No TV', 'No Washing Machine', 'No Water Purifier']",Power Back-up Intercom Facility Lift Separate entry for servant room Bank Attached Property Swimming Pool Park Security Personnel Natural Light Shopping Centre Fitness Centre  GYM Rain Water Harvesting Club house  Community Center Water softening plant,F79872191,"3 BHK flat in  Pareena Express Heights ,  Sector 99",99
"4 BHK Flatin Sector 99, Gurgaon",https://www.99acres.com/4-bhk-bedroom-apartment-flat-for-sale-in-pareena-express-heights-sector-99-gurgaon-2890-sq-ft-spid-V79872693,4.1,  Pareena Express Heights,2.45,2890.0,,4 Bedrooms,4 Bathrooms,Servant Room,"Pareena Express Heights Sector 99, Gurgaon",10th   of 14 Floors,North-East,1 to 5 Year Old,"Ocus Medley Dwarka Expy, Sector 88 Euro Intl School, Sector 37D, Gurugram Basant Valley School SGT University Vibrant Hospital Indira Gandhi Intl Airport Haier appliances India Pvt LTD","This 4 bhk flat is located in pareena express heights, which houses some of the most spacious flats in sector 99 gurgaon. This is a north-East-Facing property. The flat is over 2890 sq.Ft. Super built up area and comes with 4 bedroom(s), 4 bathrooms and 1 balcony. The residential building has 14 flo...","['4 Wardrobe', '6 Fan', '1 Exhaust Fan', '2 Geyser', '6 Light', '1 Chimney', '1 Curtains', '4 AC', '1 Modular Kitchen', 'No Bed', 'No Dining Table', 'No Microwave', 'No Fridge', 'No Sofa', 'No Stove', 'No TV', 'No Washing Machine', 'No Water Purifier']",Security  Fire Alarm Power Back-up Feng Shui  Vaastu Compliant Intercom Facility Lift High Ceiling Height Maintenance Staff Water Storage Bank Attached Property Visitor Parking Swimming Pool Park Security Personnel Natural Light Shopping Centre Fitness Centre  GYM Rain Water Harvesting Club house  Community Center Water softening plant,V79872693,"4 BHK flat in  Pareena Express Heights ,  Sector 99",99
"4 BHK Flatin Sector 82A, Gurgaon",https://www.99acres.com/4-bhk-bedroom-apartment-flat-for-sale-in-dlf-the-primus-sector-82a-gurgaon-2306-sq-ft-spid-N80225909,4.2,  DLF The Primus,3.72,2306.0,1340.0,4 Bedrooms,4 Bathrooms,Store Room,"DLF The Primus Sector 82A, Gurgaon",7th   of 13 Floors,North-East,1 to 5 Year Old,Sapphire 83 NH 48 Cambridge Montessori Miracles Apollo Hospital IGI Airport Garhi Harsaru Junction Hyatt Regency,"Dlf primus is a luxury property which is very close to malls ,markets, and schools, unmatched location and well connected with nh-8,dwarka expressway etc. Which is offer a fully fitted 3bhk and 4bhk apartment with luxury club house,,","['4 Wardrobe', '1 Fridge', '1 Exhaust Fan', '5 Geyser', '1 Washing Machine', '1 Microwave', '5 Light', '5 AC', '1 Chimney', '1 Modular Kitchen', 'No Bed', 'No Curtains', 'No Dining Table', 'No Fan', 'No Sofa', 'No Stove', 'No TV', 'No Water Purifier']",Security  Fire Alarm Power Back-up Feng Shui  Vaastu Compliant Intercom Facility Lift High Ceiling Height Maintenance Staff False Ceiling Lighting Water Storage Separate entry for servant room No open drainage around Bank Attached Property Piped-gas Internetwi-fi connectivity Visitor Parking Swimming Pool Park Security Personnel Natural Light Airy Rooms Spacious Interiors Low Density Society Waste Disposal Rain Water Harvesting Water softening plant Shopping Centre Fitness Centre  GYM Club house  Community Center,N80225909,"4 BHK flat in  DLF The Primus ,  Sector 82A",82
"3 BHK Flatin Sector 1 Imt Manesar, Gurgaon",https://www.99acres.com/3-bhk-bedroom-apartment-flat-for-sale-in-imt-view-society-sector-1-imt-manesar-gurgaon-2600-sq-ft-spid-A79122203,,  IMT View Society,1.55,2600.0,,3 Bedrooms,3 Bathrooms,Servant Room,"IMT View Society Sector 1 Imt Manesar, Gurgaon",5th   of 7 Floors,West,5 to 10 Year Old,Pooja Clinic Dr. Sahil Clinic Prakash Hospital Shri Rade Clinic Yadav Dental & Eye Care Dental Hospital Petrol pump Maitri motors Petrol Pump Petrol Pump Indian Oil McDonald's McDonald's Rao Dhaba Taikisha Engineering India PVT. LTD.,"Check out this 3 bhk apartment for sale in imt view society, a popular residential project that houses in-Demand flats in sector 1 imt manesar, gurgaon. This residential flat is west-Facing direction. Constructed on a super built up area of 2600 sq.Ft., the flat comprises 3 bedroom(s), 3 bathrooms a...","['3 Wardrobe', '13 Fan', '1 Exhaust Fan', '4 Geyser', '22 Light', '1 Curtains', '1 Modular Kitchen', '1 Chimney', 'No AC', 'No Bed', 'No Dining Table', 'No Microwave', 'No Fridge', 'No Sofa', 'No Stove', 'No TV', 'No Washing Machine', 'No Water Purifier']",Feng Shui  Vaastu Compliant Security  Fire Alarm Intercom Facility Lift Maintenance Staff Water Storage Park Visitor Parking,A79122203,"3 BHK flat in  IMT View Society ,  Sector 1 Imt Manesar",1
"3 BHK Flatin Sector 22, Gurgaon",https://www.99acres.com/3-bhk-bedroom-apartment-flat-for-sale-in-ambience-creacions-sector-22-gurgaon-3090-sq-ft-spid-F80763633,3.7,  Ambience Creacions,5.56,3090.0,,3 Bedrooms,5 Bathrooms,Servant Room,"Ambience Creacions Sector 22, Gurgaon",15th   of 19 Floors,North-East,1 to 5 Year Old,Iffco Chowk Metro Station Star Mall Old Delhi Gurgaon Road Gurgaon - Delhi Expy The NorthCap University Swiss Cottage School Manipal Hospital Indira Gandhi International Airport Gurgaon Railway Station Global Business Park Hyatt Place Fun N Food Water & Amusment Park Hamoni Golf Camp,"This beautiful 3 bhk flat in sector 22 gurgaon is situated in ambience creacions, one of the popular residential society in gurgaon. This property faces the north-East direction. The flat occupies a super built up area of 3090 sq.Ft. That consists of 3 bedrooms, 5 bathrooms and more than 3 balconies...","['1 Water Purifier', '7 Fan', '1 Fridge', '1 Exhaust Fan', '4 Geyser', '1 Stove', '9 Light', '5 AC', '1 Modular Kitchen', '1 Chimney', '3 Wardrobe', '1 Washing Machine', '1 Microwave', 'No Bed', 'No Curtains', 'No Dining Table', 'No Sofa', 'No TV']",Centrally Air Conditioned Water purifier Security  Fire Alarm Feng Shui  Vaastu Compliant Intercom Facility Lift High Ceiling Height Maintenance Staff False Ceiling Lighting Water Storage Separate entry for servant room No open drainage around Bank Attached Property Piped-gas Recently Renovated Visitor Parking Swimming Pool Park Security Personnel Natural Light Airy Rooms Spacious Interiors Low Density Society Waste Disposal Rain Water Harvesting Water softening plant Shopping Centre Fitness Centre  GYM Club house  Community Center,F80763633,"3 BHK flat in  Ambience Creacions ,  Sector 22",22
"3 BHK Flatin Sector 83, Gurgaon",https://www.99acres.com/3-bhk-bedroom-apartment-flat-for-sale-in-vatika-gurgaon-21-sector-83-gurgaon-1980-sq-ft-spid-E80154957,3.9,  Vatika Gurgaon 21,2.2,1980.0,,3 Bedrooms,3 Bathrooms,"Pooja Room,Study Room,Servant Room,Store Room","Vatika Gurgaon 21 Sector 83, Gurgaon",7th   of 18 Floors,North-East,1 to 5 Year Old,"Huda Metro Station (Gurugram) Sapphire 83 Mall Vatika Sector Road Gurgaon - Delhi Expy Dwarka Expy Euro International School, Sec 84 DPG Degree College Aarvy Healthcare Super Speciality Indira Gandhi Intl Airport Garhi Harsaru Junction","This is a fatastic property located in a prime location. It offers all modern amenities,including a sedicated children's play area and much moch more. It is ab ideal choice for comfirtable and luxurious living","['1 Water Purifier', '6 Fan', '1 Fridge', '1 Exhaust Fan', '1 Dining Table', '1 Stove', '2 TV', '1 Modular Kitchen', '1 Chimney', '1 Curtains', '2 Wardrobe', '1 Sofa', '1 Washing Machine', '1 Microwave', 'No AC', 'No Bed', 'No Geyser', 'No Light']",Security  Fire Alarm Intercom Facility Lift High Ceiling Height Maintenance Staff Water Storage Separate entry for servant room Visitor Parking Swimming Pool Park Security Personnel Internetwi-fi connectivity Shopping Centre Fitness Centre  GYM Rain Water Harvesting Club house  Community Center Water softening plant,E80154957,"3 BHK flat in  Vatika Gurgaon 21 ,  Sector 83",83
"2 BHK Flatin Sector 106, Gurgaon",https://www.99acres.com/2-bhk-bedroom-apartment-flat-for-sale-in-paras-dews-sector-106-gurgaon-1385-sq-ft-spid-P79516581,3.8,  Paras Dews,1.45,1385.0,,2 Bedrooms,2 Bathrooms,,"Paras Dews Sector 106, Gurgaon",5th   of 24 Floors,East,1 to 5 Year Old,MG Road Metro Station NeoSquare Shopping Mall Dwarka Expressway Glorious World School DPG Institute of Technology Chirag Hospital Indira Gandhi International Airport Gurgaon Country Inn & Suites by Radisson SkyJumper Trampoline Park Hamoni Golf Camp,"It's a brand new 2 bhk apartment with 3 acs, corner flat. If you are looking for buying a fresh and ready to move in 2 bhk with 2 covered car parking and bang on dwarka expressway than it's a right choice. Come and have a look for it. Call me for site visit and more details.","['3 AC', 'No Bed', 'No Chimney', 'No Curtains', 'No Dining Table', 'No Exhaust Fan', 'No Fan', 'No Geyser', 'No Modular Kitchen', 'No Light', 'No Microwave', 'No Fridge', 'No Sofa', 'No Stove', 'No TV', 'No Wardrobe', 'No Washing Machine', 'No Water Purifier']",Power Back-up Intercom Facility Lift Maintenance Staff Water Storage Visitor Parking Swimming Pool Park Security Personnel Shopping Centre Fitness Centre  GYM Rain Water Harvesting Club house  Community Center,P79516581,"2 BHK flat in  Paras Dews ,  Sector 106",106
"3 BHK FlatinSector 61, Gurgaon",https://www.99acres.com/3-bhk-bedroom-apartment-flat-for-sale-in-pioneer-park-sector-61-gurgaon-2400-sq-ft-spid-V79959361,3.6,  Pioneer Park,4.15,,2400.0,3 Bedrooms,4 Bathrooms,"Study Room,Servant Room","Pioneer Park Sector 61, Gurgaon",8th   of 32 Floors,North-West,5 to 10 Year Old,Sector 55-56 Rapid Metro Hong Kong Bazaar Golf Course Ext Rd Gurugram University Pathways School Gurgaon W Pratiksha Hospital Indira Gandhi International Airport Duke Horse Riding Club DLF Golf and Country Club AIPL Business Club Radisson Hotel Gurugram SkyJumper Trampoline Park PVR Drive In Theatre Surajgarh Gurgaon,"This beautiful 3 bhk flat in sector 61 gurgaon is situated in pioneer park, one of the popular residential society in gurgaon. Containing 3 bedroom(s), 4 bathrooms , store room, servent room and 3 balconies, this flat is spread over a built up area of 2400 sq.Ft. The property is located on the 8th f...","['4 Wardrobe', '4 Fan', '1 Exhaust Fan', '4 Geyser', '10 Light', '1 Modular Kitchen', '1 Curtains', '1 Chimney', 'No AC', 'No Bed', 'No Dining Table', 'No Microwave', 'No Fridge', 'No Sofa', 'No Stove', 'No TV', 'No Washing Machine', 'No Water Purifier']",Power Back-up Lift Swimming Pool Park Piped-gas Fitness Centre  GYM Club house  Community Center,V79959361,"3 BHK flat in  Pioneer Park , Sector 61",61
"3 BHK FlatinSector 99A, Gurgaon",https://www.99acres.com/3-bhk-bedroom-apartment-flat-for-sale-in-pareena-coban-residences-sector-99a-gurgaon-1997-sq-ft-spid-G79340163,,  Pareena Coban Residences,1.89,1997.0,1220.0,3 Bedrooms,5 Bathrooms,Servant Room,"Pareena Coban Residences Sector 99A, Gurgaon",6th   of 20 Floors,East,1 to 5 Year Old,Dwarka Expressway MDS Public School SGT University The Care Hospital Indira Gandhi International Airport Basai Dhankot SK Residency Rangmanch Farms Daultabad stadium,"This beautiful 3 bhk flat in sector 99a gurgaon is situated in pareena coban residences, one of the popular residential society in gurgaon. This residential flat is east-Facing direction. The floor plan additionally contains 3 bedroom(s), 5 bathrooms and 3 balconies. All in all, the flat is spread o...","['1 Geyser', '1 Stove', '5 AC', '1 Modular Kitchen', '1 Chimney', 'No Bed', 'No Curtains', 'No Dining Table', 'No Exhaust Fan', 'No Fan', 'No Light', 'No Microwave', 'No Fridge', 'No Sofa', 'No TV', 'No Wardrobe', 'No Washing Machine', 'No Water Purifier']",Water purifier Centrally Air Conditioned Security  Fire Alarm Feng Shui  Vaastu Compliant Intercom Facility Lift High Ceiling Height Maintenance Staff False Ceiling Lighting Water Storage Separate entry for servant room No open drainage around Bank Attached Property Piped-gas Internetwi-fi connectivity Recently Renovated Visitor Parking Swimming Pool Park Security Personnel Natural Light Airy Rooms Spacious Interiors Low Density Society Waste Disposal Rain Water Harvesting Water softening plant Shopping Centre Fitness Centre  GYM Club house  Community Center,G79340163,"3 BHK flat in  Pareena Coban Residences , Sector 99A",99
"3 BHK FlatinSector 92, Gurgaon",https://www.99acres.com/3-bhk-bedroom-apartment-flat-for-sale-in-bestech-park-view-sanskruti-sector-92-gurgaon-1995-sq-ft-spid-X80115595,4.1,  Bestech Park View Sanskruti,2.3,1995.0,,3 Bedrooms,4 Bathrooms,Servant Room,"Bestech Park View Sanskruti Sector 92, Gurgaon",7th   of 19 Floors,East,0 to 1 Year Old,"Sapphire 93 Mall Dwarka Expressway NH-8, Imt Manesar Western Peripheral Expressway RPS International School Sector 89 DPG Institute of Technology Aarvy Healthcare Hospital Indira Gandhi International Airport Holiday Inn Sector 90 De Adventure Park National Tennis Academy Sector 98",3bhk+s is available for sale in bestech park view sanskruti sector 92 gurgaon. Sun facing and park facing unit.,"['3 Wardrobe', '5 AC', 'No Bed', 'No Chimney', 'No Curtains', 'No Dining Table', 'No Exhaust Fan', 'No Fan', 'No Geyser', 'No Modular Kitchen', 'No Light', 'No Microwave', 'No Fridge', 'No Sofa', 'No Stove', 'No TV', 'No Washing Machine', 'No Water Purifier']",Security  Fire Alarm Power Back-up Feng Shui  Vaastu Compliant Intercom Facility Lift Maintenance Staff Water Storage Visitor Parking Swimming Pool Park Security Personnel Fitness Centre  GYM Rain Water Harvesting Club house  Community Center,X80115595,"3 BHK flat in  Bestech Park View Sanskruti , Sector 92",92
"3 BHK FlatinSector 102, Gurgaon",https://www.99acres.com/3-bhk-bedroom-apartment-flat-for-sale-in-emaar-gurgaon-greens-sector-102-gurgaon-1650-sq-ft-spid-G80220585,4.1,  Emaar Gurgaon Greens,1.87,1650.0,,3 Bedrooms,4 Bathrooms,Servant Room,"Emaar Gurgaon Greens Sector 102, Gurgaon",9th   of 14 Floors,North-East,1 to 5 Year Old,JMS Marine Square Mall Dwarka Expressway Basai Road Prime Scholars Int. School DPG Institute of Technology Vibrant Hospital Indira Gandhi International Airport IMT Manesar SkyJumper Trampoline Park Ramgarh Farms & Resort,"This 3 bhk apartment is available for sale in emaar gurgaon greens, one of the most prominent projects for flats in sector 102 gurgaon. The flat is north-East-Facing. The flat occupies a super built up area of 1650 sq.Ft. That consists of 3 bedrooms, 4 bathrooms and 3 balconies. This flat lies on th...","['1 Exhaust Fan', '5 Light', '1 Modular Kitchen', 'No AC', 'No Bed', 'No Chimney', 'No Curtains', 'No Dining Table', 'No Fan', 'No Geyser', 'No Microwave', 'No Fridge', 'No Sofa', 'No Stove', 'No TV', 'No Wardrobe', 'No Washing Machine', 'No Water Purifier']",Security  Fire Alarm Power Back-up Feng Shui  Vaastu Compliant Intercom Facility Lift Maintenance Staff Water Storage Separate entry for servant room No open drainage around Bank Attached Property Piped-gas Visitor Parking Swimming Pool Park Security Personnel Natural Light Airy Rooms Spacious Interiors Low Density Society Shopping Centre Fitness Centre  GYM Rain Water Harvesting Club house  Community Center,G80220585,"3 BHK flat in  Emaar Gurgaon Greens , Sector 102",102
