propertName,links,rating,society,price,area,areaWithType,bedRooms,bathRooms,additionalRooms,address,floorNum,facing,agePossesion,nearbyLocation,description,furnishDetails,features,propertyId,flatName,sector
"2 BHK Flatin Sector 62, Gurgaon",https://www.99acres.com/2-bhk-bedroom-apartment-flat-for-sale-in-emaar-digihomes-sector-62-gurgaon-1508-sq-ft-spid-H80253821,3.8,  Emaar Digihomes,3.6,,1508.0,2 Bedrooms,2 Bathrooms,,"Emaar Digihomes Sector 62, Gurgaon",22nd   of 32 Floors,East,1 to 5 Year Old,Paras Trinity Mall Badshahpur Sohna Road Highway Heritage Xperiential Learning School ICFAI Business School (IBS) Gurugram University Marengo Asia Hospitals Indira Gandhi International Airport Gurgaon Railway Station AIPL Business Club Lemon Tree Hotel Sector 55-56 Metro Station Surajgarh Gurgaon Powered By Toddy TERI Golf Course Tau DeviLal Sports Complex,"This 2 bhk apartment is available for sale in emaar digihomes, one of the most prominent projects for flats in sector 62 gurgaon. The flat is facing the north-East direction. Constructed on a carpet area of 1508 sq.Ft., the flat comprises 2 bedroom(s), 2 bathrooms and 3 balconies. The property is lo...","['3 Wardrobe', '4 Fan', '1 Exhaust Fan', '10 Light', '1 Modular Kitchen', '1 Chimney', 'No AC', 'No Bed', 'No Curtains', 'No Dining Table', 'No Geyser', 'No Microwave', 'No Fridge', 'No Sofa', 'No Stove', 'No TV', 'No Washing Machine', 'No Water Purifier']",Feng Shui  Vaastu Compliant Security  Fire Alarm Intercom Facility Lift Swimming Pool Maintenance Staff Water Storage Park Visitor Parking Fitness Centre  GYM Club house  Community Center,H80253821,"2 BHK flat in  Emaar Digihomes ,  Sector 62",62
"3 BHK Flatin Sector 70, Gurgaon",https://www.99acres.com/3-bhk-bedroom-apartment-flat-for-sale-in-gpl-eden-heights-sector-70-gurgaon-2150-sq-ft-spid-O79493875,4.1,  GPL Eden Heights,2.8,2150.0,,3 Bedrooms,4 Bathrooms,"Study Room,Servant Room","GPL Eden Heights Sector 70, Gurgaon",7th   of 16 Floors,East,1 to 5 Year Old,ILD Trade Centre Mall Southern Peripheral Rd Gurugram University Scottish High International School Park Hospital Indira Gandhi Intl Airport,"This 3 bhk apartment is available for sale in gpl eden heights, one of the most prominent projects for flats in sector 70 gurgaon. This is a east-Facing property. Constructed on a super built up area of 2150 sq.Ft., the flat comprises 3 bedroom(s), 4 bathrooms and 3 balconies. The property is locate...","['2 Wardrobe', '4 Fan', '1 Exhaust Fan', '7 Light', '1 Chimney', '1 Modular Kitchen', 'No AC', 'No Bed', 'No Curtains', 'No Dining Table', 'No Geyser', 'No Microwave', 'No Fridge', 'No Sofa', 'No Stove', 'No TV', 'No Washing Machine', 'No Water Purifier']",Water purifier Centrally Air Conditioned Security  Fire Alarm Power Back-up Feng Shui  Vaastu Compliant Private Garden  Terrace Intercom Facility Lift High Ceiling Height Maintenance Staff False Ceiling Lighting Water Storage Separate entry for servant room No open drainage around Bank Attached Property Piped-gas Internetwi-fi connectivity Recently Renovated Visitor Parking Swimming Pool Park Security Personnel Natural Light Airy Rooms Spacious Interiors Low Density Society Waste Disposal Rain Water Harvesting Water softening plant Shopping Centre Fitness Centre  GYM Club house  Community Center,O79493875,"3 BHK flat in  GPL Eden Heights ,  Sector 70",70
"4 BHK Flatin Sector 107, Gurgaon",https://www.99acres.com/4-bhk-bedroom-apartment-flat-for-sale-in-m3m-woodshire-sector-107-gurgaon-2768-sq-ft-spid-K80171835,4.1,  M3M Woodshire,2.6,2768.0,,4 Bedrooms,5 Bathrooms,Servant Room,"M3M Woodshire Sector 107, Gurgaon",12nd   of 14 Floors,North-East,1 to 5 Year Old,Signum 107 Nora Solomon Medicenter Indira Gandhi International Airport The Shikshiyan School Najafgarh Jheel Bird Sanctuary Skylark Cricket Academy,"Located in the popular residential address of sector 107 gurgaon, m3m woodshire is one of the most preferred destination for apartments in gurgaon. This 4 bhk flat is your ticket to be a part of this community. This residential flat is north-East-Facing direction. Constructed on a super built up are...","['1 Wardrobe', '1 Fan', '1 Exhaust Fan', '1 Geyser', '1 Light', '1 Chimney', '1 Modular Kitchen', '1 Curtains', '1 AC', 'No Bed', 'No Dining Table', 'No Microwave', 'No Fridge', 'No Sofa', 'No Stove', 'No TV', 'No Washing Machine', 'No Water Purifier']",Security  Fire Alarm Power Back-up Feng Shui  Vaastu Compliant Intercom Facility Lift Maintenance Staff Water Storage Visitor Parking Swimming Pool Park Security Personnel Shopping Centre Fitness Centre  GYM Rain Water Harvesting Club house  Community Center,K80171835,"4 BHK flat in  M3M Woodshire ,  Sector 107",107
"4 BHK Flatin Sector 99A, Gurgaon",https://www.99acres.com/4-bhk-bedroom-apartment-flat-for-sale-in-pareena-coban-residences-sector-99a-gurgaon-2352-sq-ft-spid-P80197843,,  Pareena Coban Residences,2.3,2352.0,1465.0,4 Bedrooms,5 Bathrooms,Servant Room,"Pareena Coban Residences Sector 99A, Gurgaon",12nd   of 20 Floors,South,1 to 5 Year Old,Dwarka Expressway MDS Public School SGT University The Care Hospital Indira Gandhi International Airport Basai Dhankot SK Residency Rangmanch Farms Daultabad stadium,"Looking for a 4 bhk property for sale in gurgaon? Buy this 4 bhk flat in pareena coban residences that is situated in sector 99a gurgaon. This property faces the north-East direction. The floor plan additionally contains 4 bedroom(s), 5 bathrooms and more than 3 balconies. All in all, the flat is sp...","['1 Wardrobe', '1 Fan', '1 Exhaust Fan', '1 Geyser', '1 Light', '1 Modular Kitchen', '1 AC', '1 Chimney', '1 Curtains', 'No Bed', 'No Dining Table', 'No Microwave', 'No Fridge', 'No Sofa', 'No Stove', 'No TV', 'No Washing Machine', 'No Water Purifier']",Security  Fire Alarm Power Back-up Feng Shui  Vaastu Compliant Intercom Facility Lift Maintenance Staff Water Storage Visitor Parking Swimming Pool Park Security Personnel Shopping Centre Fitness Centre  GYM Rain Water Harvesting Club house  Community Center,P80197843,"4 BHK flat in  Pareena Coban Residences ,  Sector 99A",99
"4 BHK Flatin Sector 79, Gurgaon",https://www.99acres.com/4-bhk-bedroom-apartment-flat-for-sale-in-bestech-altura-sector-79-gurgaon-2675-sq-ft-spid-Q79406311,,  Bestech Altura,3.45,2675.0,,4 Bedrooms,5 Bathrooms,Servant Room,"Bestech Altura Sector 79, Gurgaon",8th   of 20 Floors,East,0 to 1 Year Old,"Sapphire 83 Mall NH -8 Golf Course Extension Road Mount Olympus Junior School Amity University Gurugram Miracles Apollo Hospital Indira Gandhi International Airport Garhi Harsaru Junction IMT Manesar Savoy Suites, Manesar Golden Greens Golf & Resorts",4bhk is available for sale in bestech altura sector 79 gurgaon. Sun and park facing unit.,"['6 AC', '1 Modular Kitchen', 'No Bed', 'No Chimney', 'No Curtains', 'No Dining Table', 'No Exhaust Fan', 'No Fan', 'No Geyser', 'No Light', 'No Microwave', 'No Fridge', 'No Sofa', 'No Stove', 'No TV', 'No Wardrobe', 'No Washing Machine', 'No Water Purifier']",Power Back-up Intercom Facility Lift High Ceiling Height Maintenance Staff False Ceiling Lighting Separate entry for servant room No open drainage around Piped-gas Swimming Pool Park Security Personnel Natural Light Internetwi-fi connectivity Airy Rooms Shopping Centre Fitness Centre  GYM Waste Disposal Rain Water Harvesting Club house  Community Center Water softening plant,Q79406311,"4 BHK flat in  Bestech Altura ,  Sector 79",79
"4 BHK Flatin Sector 99, Gurgaon",https://www.99acres.com/4-bhk-bedroom-apartment-flat-for-sale-in-vatika-sovereign-park-sector-99-gurgaon-3360-sq-ft-spid-X80020019,3.8,  Vatika Sovereign Park,3.9,3360.0,,4 Bedrooms,4 Bathrooms,"Pooja Room,Study Room,Servant Room,Store Room","Vatika Sovereign Park Sector 99, Gurgaon",3rd   of 12 Floors,East,0 to 1 Year Old,The Esplanade Mall Dwarka Expressway KMP Expressway Imperial Heritage School SGT University Vibrant Hospital Indira Gandhi International Airport IMT Manesar Quality Inn Gurgaon SkyJumper Trampoline Park,"Vatika sovereign park, sector 99 size:3360 sqft is available for sale @4.50cr vatika sovereign park is ideal for those who value luxury, convenience, and security, with a touch of nature. It offers a well-Rounded living experience for families, professionals, and individuals alike.","['1 Water Purifier', '6 Fan', '1 Exhaust Fan', '1 Microwave', '8 Light', '6 AC', '1 TV', '1 Modular Kitchen', '1 Curtains', '1 Chimney', 'No Bed', 'No Dining Table', 'No Geyser', 'No Fridge', 'No Sofa', 'No Stove', 'No Wardrobe', 'No Washing Machine']",Water purifier Centrally Air Conditioned Security  Fire Alarm Power Back-up Feng Shui  Vaastu Compliant Private Garden  Terrace Intercom Facility Lift High Ceiling Height Maintenance Staff False Ceiling Lighting Water Storage Separate entry for servant room No open drainage around Bank Attached Property Piped-gas Internetwi-fi connectivity Recently Renovated Visitor Parking Swimming Pool Park Security Personnel Natural Light Airy Rooms Spacious Interiors Low Density Society Waste Disposal Rain Water Harvesting Water softening plant Shopping Centre Fitness Centre  GYM Club house  Community Center,X80020019,"4 BHK flat in  Vatika Sovereign Park ,  Sector 99",99
"2 BHK Flatin Sector 84, Gurgaon",https://www.99acres.com/2-bhk-bedroom-apartment-flat-for-sale-in-ss-the-coralwood-sector-84-gurgaon-1425-sq-ft-spid-V66455738,3.5,  SS The Coralwood,1.36,1425.0,,2 Bedrooms,2 Bathrooms,,"SS The Coralwood Sector 84, Gurgaon",11st   of 21 Floors,East,1 to 5 Year Old,"Sapphire 83 Mall Sector 84 Road Dwarka Expy Delhi Public School, Sector 84 DPG Degree College Aarvy Hospital Indira Gandhi Intl Airport Garhi Harsaru Junction Skyview Corporate Park Hyatt Regency Gurgaon AapnoGhar Manesar Golf Course Nakhrola Stadium",Multiple flats available in all sizes.Call growth realtech.Key in hand,"['3 Fan', '2 Geyser', '4 Light', '1 Chimney', 'No AC', 'No Bed', 'No Curtains', 'No Dining Table', 'No Exhaust Fan', 'No Modular Kitchen', 'No Microwave', 'No Fridge', 'No Sofa', 'No Stove', 'No TV', 'No Wardrobe', 'No Washing Machine', 'No Water Purifier']",Feng Shui  Vaastu Compliant Intercom Facility Lift Maintenance Staff Water Storage Visitor Parking Swimming Pool Park Internetwi-fi connectivity Shopping Centre Fitness Centre  GYM Waste Disposal Rain Water Harvesting Club house  Community Center,V66455738,"2 BHK flat in  SS The Coralwood ,  Sector 84",84
"2 BHK Flatin Sector 67, Gurgaon",https://www.99acres.com/2-bhk-bedroom-apartment-flat-for-sale-in-ireo-victory-valley-sector-67-gurgaon-1470-sq-ft-spid-E80786023,4.0,  Ireo Victory Valley,2.75,1470.0,1450.0,2 Bedrooms,2 Bathrooms,Pooja Room,"Ireo Victory Valley Sector 67, Gurgaon",9th   of 35 Floors,North,1 to 5 Year Old,AIPL Joy Street Mall Golf Course Extension Road Alpine Convent School DPG Institute of Technology CK Birla Hospital Indira Gandhi International Airport iON Digital Zone (Gurugram) Radisson Hotel Sohna Road SkyJumper Trampoline Park HUDA Mini Golf Course PVR Drive in Theatre,"Ireo victory valley is one of the most preferred destination for apartments in gurgaon. This 2 bhk flat is your ticket to be a part of this community. Constructed on a super built up area of 1470 sq.Ft., the flat comprises 2 bedroom(s), 2 bathrooms and 3 balconies. This flat is situated on the 9th f...","['3 Wardrobe', '6 Fan', '1 Exhaust Fan', '3 Geyser', '1 Stove', '16 Light', '1 Modular Kitchen', '1 Curtains', '1 Chimney', '4 AC', 'No Bed', 'No Dining Table', 'No Microwave', 'No Fridge', 'No Sofa', 'No TV', 'No Washing Machine', 'No Water Purifier']",Centrally Air Conditioned Security  Fire Alarm Power Back-up Feng Shui  Vaastu Compliant Intercom Facility Lift High Ceiling Height Maintenance Staff False Ceiling Lighting Water Storage Separate entry for servant room No open drainage around Piped-gas Internetwi-fi connectivity Recently Renovated Visitor Parking Swimming Pool Park Natural Light Airy Rooms Spacious Interiors Low Density Society Waste Disposal Rain Water Harvesting Water softening plant Shopping Centre Fitness Centre  GYM Club house  Community Center,E80786023,"2 BHK flat in  Ireo Victory Valley ,  Sector 67",67
"3 BHK Flatin Sector 67, Gurgaon",https://www.99acres.com/3-bhk-bedroom-apartment-flat-for-sale-in-bestech-park-view-spa-next-sector-67-gurgaon-1935-sq-ft-spid-K80661815,3.8,  Bestech Park View Spa Next,3.3,1935.0,1932.0,3 Bedrooms,4 Bathrooms,Servant Room,"Bestech Park View Spa Next Sector 67, Gurgaon",7th   of 14 Floors,North,5 to 10 Year Old,Omaxe City Centre Mall Golf Course Extension Road St. Xavier's School KIIT College of Engineering Ektaa Hospital Indira Gandhi International Airport Surajgarh Gurgaon Duke Horse Riding Club Radisson Hotel Gurugram SkyJumper Trampoline Park HUDA Mini Golf Course PVR Drive In Theater,"Located in the popular residential address of sector 67 gurgaon, bestech park view spa next is one of the most preferred destination for apartments in gurgaon. This 3 bhk flat is your ticket to be a part of this community. This is a north-Facing property. Containing 3 bedroom(s), 4 bathrooms and mor...","['4 Wardrobe', '6 Fan', '1 Exhaust Fan', '4 Geyser', '1 Stove', '18 Light', '5 AC', '1 Chimney', '1 Modular Kitchen', '1 Curtains', 'No Bed', 'No Dining Table', 'No Microwave', 'No Fridge', 'No Sofa', 'No TV', 'No Washing Machine', 'No Water Purifier']",Centrally Air Conditioned Security  Fire Alarm Power Back-up Feng Shui  Vaastu Compliant Intercom Facility Lift High Ceiling Height Maintenance Staff False Ceiling Lighting Water Storage Separate entry for servant room No open drainage around Piped-gas Internetwi-fi connectivity Recently Renovated Visitor Parking Swimming Pool Park Natural Light Airy Rooms Spacious Interiors Low Density Society Waste Disposal Rain Water Harvesting Water softening plant Shopping Centre Fitness Centre  GYM Club house  Community Center,K80661815,"3 BHK flat in  Bestech Park View Spa Next ,  Sector 67",67
"2 BHK Flatin Sector 68, Gurgaon",https://www.99acres.com/2-bhk-bedroom-apartment-flat-for-sale-in-pareena-mi-casa-sector-68-gurgaon-1245-sq-ft-spid-C79735197,3.7,  Pareena Mi Casa,1.55,1245.0,900.0,2 Bedrooms,2 Bathrooms,Others,"Pareena Mi Casa Sector 68, Gurgaon",12nd   of 35 Floors,East,0 to 1 Year Old,Sector 55-56 Metro Station Airia Mall NH 48 The Vivekananda School - Sector 69 Gurugram University Park Hospital Indira Gandhi International Airport Gurgaon Railway Station Spaze Corporate Park Golden Greens Golf & Resorts Limited Tau DeviLal Sports Complex,"Luxury society apartment 
All amenities available 
Clubhouse 
Gym
Swimming pool 
Restaurant 
Spa center2bhk spaces full luxury flat","['2 Wardrobe', '4 Fan', '1 Exhaust Fan', '2 Geyser', '4 Light', '1 Curtains', '1 Modular Kitchen', '3 AC', '1 Chimney', 'No Bed', 'No Dining Table', 'No Microwave', 'No Fridge', 'No Sofa', 'No Stove', 'No TV', 'No Washing Machine', 'No Water Purifier']",Power Back-up Feng Shui  Vaastu Compliant Intercom Facility Lift Swimming Pool Maintenance Staff Park Piped-gas Security Personnel Fitness Centre  GYM Club house  Community Center Rain Water Harvesting,C79735197,"2 BHK flat in  Pareena Mi Casa ,  Sector 68",68
"3 BHK Flatin Sector 65, Gurgaon",https://www.99acres.com/3-bhk-bedroom-apartment-flat-for-sale-in-m3m-latitude-sector-65-gurgaon-2450-sq-ft-spid-E79631683,3.6,  M3M Latitude,5.79,2450.0,1600.0,3 Bedrooms,3 Bathrooms,"Pooja Room,Study Room,Servant Room,Store Room","M3M Latitude Sector 65, Gurgaon",37th   of 42 Floors,East,1 to 5 Year Old,"Sector 55-56 Metro Station M3M Cosmopolitan Badshahpur Sohna Rd Hwy, Haryana NH 48, Sector 78 St. Xavier's High School Gurugram University Medanta -The Medicity M3M International Financial Center (IFC) Holiday Inn Express Gurugram Sec 50","M3m latitude is one of the most popular destination for buying apartments/ flats in sector 65 gurgaon. You too can be a part of this society by purchasing this 3 bhk flat here. This residential flat is east-Facing direction. The floor plan additionally contains 3 bedroom(s), 3 bathrooms and more tha...","['7 Wardrobe', '7 Fan', '4 Geyser', '12 Light', '8 AC', '6 TV', 'No Bed', 'No Chimney', 'No Curtains', 'No Dining Table', 'No Exhaust Fan', 'No Modular Kitchen', 'No Microwave', 'No Fridge', 'No Sofa', 'No Stove', 'No Washing Machine', 'No Water Purifier']",Security  Fire Alarm Feng Shui  Vaastu Compliant Intercom Facility Lift High Ceiling Height Maintenance Staff False Ceiling Lighting Water Storage Separate entry for servant room No open drainage around Piped-gas Visitor Parking Swimming Pool Park Internetwi-fi connectivity Shopping Centre Fitness Centre  GYM Waste Disposal Rain Water Harvesting Club house  Community Center Water softening plant,E79631683,"3 BHK flat in  M3M Latitude ,  Sector 65",65
"2 BHK Flatin Sector 103, Gurgaon",https://www.99acres.com/2-bhk-bedroom-apartment-flat-for-sale-in-satya-the-hermitage-sector-103-gurgaon-1450-sq-ft-spid-C80773803,3.6,  Satya The Hermitage,1.24,1450.0,1200.0,2 Bedrooms,3 Bathrooms,Servant Room,"Satya The Hermitage Sector 103, Gurgaon",8th   of 11 Floors,West,5 to 10 Year Old,"Metro Hospital, Palam Vihar Huda Metro Station Gurgaon Dreamz Mall HUDA Market, Sector 14 Dwarka Expressway Delhi Jaipur Expressway Hero Honda Chowk S N International School The NorthCap University Indira Gandhi International Airport Gurgaon Railway Station infinity Business Park InfinityS Badminton Academy F9 Go Karting Gurgaon SkyJumper Trampoline Park Gurgaon","This flat is available in satya the hermitage in between 6 to 10 floor. It is 2.5 bhk. This society has full power backup, clubhouse and temple inside.","['2 Wardrobe', '1 Exhaust Fan', '7 Light', '1 Modular Kitchen', 'No AC', 'No Bed', 'No Chimney', 'No Curtains', 'No Dining Table', 'No Fan', 'No Geyser', 'No Microwave', 'No Fridge', 'No Sofa', 'No Stove', 'No TV', 'No Washing Machine', 'No Water Purifier']",Security  Fire Alarm Power Back-up Lift Maintenance Staff Water Storage No open drainage around Bank Attached Property Visitor Parking Swimming Pool Park Security Personnel Natural Light Airy Rooms Fitness Centre  GYM Club house  Community Center,C80773803,"2 BHK flat in  Satya The Hermitage ,  Sector 103",103
"3 BHK Flatin Sector 37D, Gurgaon",https://www.99acres.com/3-bhk-bedroom-apartment-flat-for-sale-in-bptp-terra-sector-37d-gurgaon-1832-sq-ft-spid-B80418917,3.9,  BPTP Terra,2.1,1832.0,1282.0,3 Bedrooms,3 Bathrooms,Store Room,"BPTP Terra Sector 37D, Gurgaon",10th   of 23 Floors,East,1 to 5 Year Old,Airia Mall Dwarka Expressway Golf Course Extension Road Euro International School DPG Institute of Technology Medanta -The Medicity Amma Hospital Indira Gandhi International Airport DLF Corporate Greens Holiday Inn Sector 90 SkyJumper Trampoline Park,"This beautiful 3 bhk flat in sector 37d gurgaon is situated in bptp terra, one of the popular residential societies in gurgaon. The flat is over 1832 sq.Ft. It is a super built-Up area and comes with 3 bedrooms (s), 3 bathrooms, and 3 balconies. The property is located on the 10th floor of a 23-Stor...","['5 Fan', '1 Exhaust Fan', '8 Light', '4 AC', '1 Modular Kitchen', '1 Chimney', '1 Curtains', 'No Bed', 'No Dining Table', 'No Geyser', 'No Microwave', 'No Fridge', 'No Sofa', 'No Stove', 'No TV', 'No Wardrobe', 'No Washing Machine', 'No Water Purifier']",Security  Fire Alarm Feng Shui  Vaastu Compliant Lift Centrally Air Conditioned Maintenance Staff False Ceiling Lighting Water Storage No open drainage around Recently Renovated Visitor Parking Swimming Pool Park Security Personnel Natural Light Low Density Society Shopping Centre Fitness Centre  GYM Rain Water Harvesting Club house  Community Center Water softening plant,B80418917,"3 BHK flat in  BPTP Terra ,  Sector 37D",37
"4 BHK Flatin Sector 37D, Gurgaon",https://www.99acres.com/4-bhk-bedroom-apartment-flat-for-sale-in-bptp-terra-sector-37d-gurgaon-2191-sq-ft-spid-S80211331,3.9,  BPTP Terra,2.65,2191.0,,4 Bedrooms,4 Bathrooms,Servant Room,"BPTP Terra Sector 37D, Gurgaon",11st   of 23 Floors,North,1 to 5 Year Old,Airia Mall Dwarka Expressway Golf Course Extension Road Euro International School DPG Institute of Technology Medanta -The Medicity Amma Hospital Indira Gandhi International Airport DLF Corporate Greens Holiday Inn Sector 90 SkyJumper Trampoline Park,"Near to dwarka expressway, ready to move, sun facing balcony, overlooking main road, club operational, all facilities available,
 Additional details :Daily needs shopping could be done within the society premises to make the stay convinent.
Full power backup is available.
The society has dedicated...","['4 Fan', '10 Light', '5 AC', 'No Bed', 'No Chimney', 'No Curtains', 'No Dining Table', 'No Exhaust Fan', 'No Geyser', 'No Modular Kitchen', 'No Microwave', 'No Fridge', 'No Sofa', 'No Stove', 'No TV', 'No Wardrobe', 'No Washing Machine', 'No Water Purifier']",Feng Shui  Vaastu Compliant Security  Fire Alarm Intercom Facility Lift Maintenance Staff Swimming Pool Water Storage Park Visitor Parking Fitness Centre  GYM Club house  Community Center Rain Water Harvesting,S80211331,"4 BHK flat in  BPTP Terra ,  Sector 37D",37
"3 BHK Flatin Sector 68, Gurgaon",https://www.99acres.com/3-bhk-bedroom-apartment-flat-for-sale-in-pareena-mi-casa-sector-68-gurgaon-1999-sq-ft-spid-F80415745,3.7,  Pareena Mi Casa,2.45,1999.0,,3 Bedrooms,4 Bathrooms,Servant Room,"Pareena Mi Casa Sector 68, Gurgaon",12nd   of 35 Floors,East,0 to 1 Year Old,Sector 55-56 Metro Station Airia Mall NH 48 The Vivekananda School - Sector 69 Gurugram University Park Hospital Indira Gandhi International Airport Gurgaon Railway Station Spaze Corporate Park Golden Greens Golf & Resorts Limited Tau DeviLal Sports Complex,"This 3 bhk apartment is available for sale in pareena mi casa, one of the most prominent projects for flats in sector 68 gurgaon. This is a east-Facing property. The floor plan additionally contains 3 bedroom(s), 4 bathrooms and more than 3 balconies. All in all, the flat is spread over a super buil...","['4 Wardrobe', '5 Fan', '1 Exhaust Fan', '2 Geyser', '11 Light', '1 Curtains', '1 Chimney', '1 Modular Kitchen', 'No AC', 'No Bed', 'No Dining Table', 'No Microwave', 'No Fridge', 'No Sofa', 'No Stove', 'No TV', 'No Washing Machine', 'No Water Purifier']",Security  Fire Alarm Power Back-up Feng Shui  Vaastu Compliant Intercom Facility Lift Maintenance Staff Water Storage Piped-gas Visitor Parking Swimming Pool Park Security Personnel Fitness Centre  GYM Rain Water Harvesting Club house  Community Center,F80415745,"3 BHK flat in  Pareena Mi Casa ,  Sector 68",68
"3 BHK Flatin Sector 78, Gurgaon",https://www.99acres.com/3-bhk-bedroom-apartment-flat-for-sale-in-umang-monsoon-breeze-sector-78-gurgaon-1659-sq-ft-spid-C79847693,3.8,  Umang Monsoon Breeze,1.55,1659.0,,3 Bedrooms,2 Bathrooms,"Store Room,Pooja Room","Umang Monsoon Breeze Sector 78, Gurgaon",18th   of 18 Floors,,5 to 10 Year Old,Proposed Metro Station Mahapal Shing National Highway 8 IGD Primary Health Care HDFC Bank PCL Logistics JW Mariott,"Check out this 3 bhk apartment for sale in umang monsoon breeze, a popular residential project that houses in-Demand flats in sector 78 gurgaon. The floor plan additionally contains 3 bedroom(s), 2 bathrooms and 3 balconies. All in all, the flat is spread over a super built up area of 1659 sq.Ft. Th...","['1 Water Purifier', '4 Fan', '1 Exhaust Fan', '1 Dining Table', '3 Geyser', '5 Light', '1 TV', '1 Chimney', '1 Modular Kitchen', '4 AC', '3 Wardrobe', '1 Microwave', 'No Bed', 'No Curtains', 'No Fridge', 'No Sofa', 'No Stove', 'No Washing Machine']",Power Back-up Feng Shui  Vaastu Compliant Intercom Facility Lift Maintenance Staff Visitor Parking Swimming Pool Park Security Personnel Internetwi-fi connectivity Shopping Centre Fitness Centre  GYM Rain Water Harvesting Club house  Community Center,C79847693,"3 BHK flat in  Umang Monsoon Breeze ,  Sector 78",78
"2 BHK Flatin Sector 68, Gurgaon",https://www.99acres.com/2-bhk-bedroom-apartment-flat-for-sale-in-m3m-sierra-68-sector-68-gurgaon-1222-sq-ft-spid-S79253845,,  M3M Sierra 68,1.55,1222.0,860.0,2 Bedrooms,2 Bathrooms,,"M3M Sierra 68 Sector 68, Gurgaon",6th   of 30 Floors,South,1 to 5 Year Old,"Airia Mall Sohna Road Golf Course Extension Road Alpine Convent School KIIT College of Engineering MKD Hospital Indira Gandhi International Airport Lemon Tree Hotel, Sohna Road SkyJumper Trampoline Park DLF Golf and Country Club","This beautiful 2 bhk flat in sector 68 gurgaon is situated in m3m sierra 68, one of the popular residential society in gurgaon. This is a north-East-Facing property. Constructed on a super built up area of 1222 sq.Ft., the flat comprises 2 bedroom(s), 2 bathrooms and 2 balconies. The property is loc...","['7 Fan', '1 Exhaust Fan', '1 Dining Table', '1 Microwave', '1 Stove', '10 Light', '1 Curtains', '1 Modular Kitchen', '1 Chimney', 'No AC', 'No Bed', 'No Geyser', 'No Fridge', 'No Sofa', 'No TV', 'No Wardrobe', 'No Washing Machine', 'No Water Purifier']",Centrally Air Conditioned Water purifier Security  Fire Alarm Power Back-up Feng Shui  Vaastu Compliant Private Garden  Terrace Intercom Facility Lift High Ceiling Height Maintenance Staff False Ceiling Lighting Water Storage Separate entry for servant room No open drainage around Bank Attached Property Piped-gas Internetwi-fi connectivity Recently Renovated Visitor Parking Swimming Pool Park Security Personnel Natural Light Airy Rooms Spacious Interiors Low Density Society Waste Disposal Rain Water Harvesting Water softening plant Shopping Centre Fitness Centre  GYM Club house  Community Center,S79253845,"2 BHK flat in  M3M Sierra 68 ,  Sector 68",68
