propertName,links,rating,society,price,area,areaWithType,bedRooms,bathRooms,additionalRooms,address,floorNum,facing,agePossesion,nearbyLocation,description,furnishDetails,features,propertyId,flatName,sector
"2 BHK Flatin Sector 3, Gurgaon",https://www.99acres.com/2-bhk-bedroom-apartment-flat-for-sale-in-godrej-habitat-sector-3-gurgaon-1444-sq-ft-r10-spid-E68327112,,  Godrej Habitat,1.32,,1444.0,2 Bedrooms,2 Bathrooms,Servant Room,"Godrej Habitat Sector 3, Gurgaon",4th   of 17 Floors,North,0 to 1 Year Old,Huda City Centre Metro Station Star Mall Dwarka Expressway National Highway 8 Gems International School ICFAI University Sneh Hospital Indira Gandhi International Airport Country Inn & Suites by Radisson Appu Ghar Water Park HUDA Mini Golf Course,2bhk semi furnished appartment for sale in godrej habitat at very good price..,"['3 Fan', '4 Light', '2 AC', '2 TV', 'No Bed', 'No Chimney', 'No Curtains', 'No Dining Table', 'No Exhaust Fan', 'No Geyser', 'No Modular Kitchen', 'No Microwave', 'No Fridge', 'No Sofa', 'No Stove', 'No Wardrobe', 'No Washing Machine', 'No Water Purifier']",Feng Shui  Vaastu Compliant Intercom Facility Lift High Ceiling Height False Ceiling Lighting Separate entry for servant room Piped-gas Swimming Pool Park Shopping Centre Fitness Centre  GYM Club house  Community Center Water softening plant,E68327112,"2 BHK flat in  Godrej Habitat ,  Sector 3",3
"3 BHK Flatin Sector 86, Gurgaon",https://www.99acres.com/3-bhk-bedroom-apartment-flat-for-sale-in-dlf-the-skycourt-sector-86-gurgaon-1929-sq-ft-spid-K79689999,4.0,  DLF The Skycourt,2.25,1929.0,1550.0,3 Bedrooms,3 Bathrooms,,"DLF The Skycourt Sector 86, Gurgaon",11st   of 19 Floors,East,1 to 5 Year Old,"Sapphire 83 Mall NH-8, Imt Manesar Rao Bharat Singh International School DPG Institute of Technology Aarvy Healthcare Indira Gandhi International Airport Imt Manesar Holiday Inn Hotel Sector 90 Aapno Ghar National Tennis Academy Sector 98","This beautiful 3 bhk flat in sector 86 gurgaon is situated in dlf the skycourt, one of the popular residential society in gurgaon. This residential flat is east-Facing direction. The floor plan additionally contains 3 bedroom(s), 3 bathrooms and 2 balconies. All in all, the flat is spread over a sup...","['1 Water Purifier', '5 Fan', '1 Fridge', '1 Exhaust Fan', '1 Dining Table', '3 Geyser', '1 Stove', '5 Light', '5 AC', '1 Modular Kitchen', '1 Chimney', '1 Curtains', '3 Wardrobe', '1 Sofa', '1 Washing Machine', '1 Microwave', 'No Bed', 'No TV']",Centrally Air Conditioned Water purifier Power Back-up Private Garden  Terrace Intercom Facility Lift High Ceiling Height False Ceiling Lighting Separate entry for servant room No open drainage around Bank Attached Property Piped-gas Internetwi-fi connectivity Recently Renovated Swimming Pool Park Security Personnel Natural Light Airy Rooms Spacious Interiors Low Density Society Waste Disposal Rain Water Harvesting Water softening plant Shopping Centre Fitness Centre  GYM Club house  Community Center,K79689999,"3 BHK flat in  DLF The Skycourt ,  Sector 86",86
"2 BHK Flatin Sector 108, Gurgaon",https://www.99acres.com/2-bhk-bedroom-apartment-flat-for-sale-in-sobha-city-sector-108-gurgaon-1381-sq-ft-spid-B79928269,3.7,  Sobha City,2.65,1381.0,848.2,2 Bedrooms,2 Bathrooms,,"Sobha City Sector 108, Gurgaon",2nd   of 24 Floors,West,1 to 5 Year Old,Dwarka Sector 21 Metro Station WTC Plaza Dwarka Expressway The Shikshiyan School The NorthCap University Rions Hospital Indira Gandhi International Airport Gurgaon Railway Station Chintels Corporate Park Sec 114 Gurgaon Country Inn & Suites by Radisson Hamoni Golf Camp Tau DeviLal Sports Complex,"Situated in sector 108 gurgaon, sobha city is a well planned society that offers a pleasant living experience to its residents. This 2 bhk flat in gurgaon is your opportunity to be a part of this community. This property faces the north-East direction. The flat occupies a super built up area of 1381...","['2 Wardrobe', '1 Water Purifier', '1 Exhaust Fan', '2 Geyser', '5 Light', '1 Chimney', '1 Modular Kitchen', '3 AC', 'No Bed', 'No Curtains', 'No Dining Table', 'No Fan', 'No Microwave', 'No Fridge', 'No Sofa', 'No Stove', 'No TV', 'No Washing Machine']",Centrally Air Conditioned Water purifier Security  Fire Alarm Power Back-up Intercom Facility Lift High Ceiling Height Maintenance Staff False Ceiling Lighting Water Storage Separate entry for servant room No open drainage around Bank Attached Property Piped-gas Swimming Pool Park Security Personnel Natural Light Airy Rooms Spacious Interiors Low Density Society Waste Disposal Rain Water Harvesting Water softening plant Shopping Centre Fitness Centre  GYM Club house  Community Center,B79928269,"2 BHK flat in  Sobha City ,  Sector 108",108
"3 BHK Flatin Sector 79, Gurgaon",https://www.99acres.com/3-bhk-bedroom-apartment-flat-for-sale-in-mapsko-mount-ville-sector-79-gurgaon-1490-sq-ft-spid-D79959105,4.1,  Mapsko Mount Ville,2.0,1490.0,,3 Bedrooms,3 Bathrooms,,"Mapsko Mount Ville Sector 79, Gurgaon",16th   of 30 Floors,East,1 to 5 Year Old,Huda Metro Station (Gurugram) Sapphire 83 Mall Naurangpur Road Delhi - Ajmer Expy Bal Bharati Public School–IMT Manesar Amity University Gurugram Miracles Apollo Cradle / Spectra Indira Gandhi Intl Airport Garhi Harsaru Junction,"This 3 bhk flat is located in mapsko mount ville, which houses some of the most spacious flats in sector 79 gurgaon. This is a east-Facing property. Containing 3 bedroom(s), 3 bathrooms and 3 balconies, this flat is spread over a super built up area of 1490 sq.Ft. The flat has a total of 30 floors a...","['3 Wardrobe', '5 Fan', '1 Exhaust Fan', '8 Light', '1 Chimney', '1 Modular Kitchen', 'No AC', 'No Bed', 'No Curtains', 'No Dining Table', 'No Geyser', 'No Microwave', 'No Fridge', 'No Sofa', 'No Stove', 'No TV', 'No Washing Machine', 'No Water Purifier']",Security  Fire Alarm Power Back-up Feng Shui  Vaastu Compliant Intercom Facility Lift High Ceiling Height Maintenance Staff Water Storage No open drainage around Recently Renovated Visitor Parking Swimming Pool Park Security Personnel Natural Light Airy Rooms Spacious Interiors Low Density Society Shopping Centre Fitness Centre  GYM Waste Disposal Rain Water Harvesting Club house  Community Center,D79959105,"3 BHK flat in  Mapsko Mount Ville ,  Sector 79",79
"3 BHK Flatin Sector 36A, Gurgaon",https://www.99acres.com/3-bhk-bedroom-apartment-flat-for-sale-in-krisumi-waterfall-residences-sector-36a-gurgaon-2538-sq-ft-spid-Y79670437,3.7,  Krisumi Waterfall Residences,4.85,2538.0,1325.69,3 Bedrooms,3 Bathrooms,,"Krisumi Waterfall Residences Sector 36A, Gurgaon",33rd   of 34 Floors,,0 to 1 Year Old,Sapphire 83 Dwarka Expressway Sector 86 Rd St. Xaviers High School Gurugram University Kathuria Hospital Indira Gandhi International Airport Gurgaon Railway Station Vatika Business Centre Holiday Inn Gurugram Sector 90 AapnoGhar Amusement Park,"1) joint venture of krishna and sumitomo group 
2) promising rental of 110rupees per sq.Ft 
3) 5 year warranty on paint, tiles and electric wires 
4) very close to global city 
5) made by tata group","['1 Wardrobe', '1 Water Purifier', '1 Exhaust Fan', '1 Geyser', '1 Washing Machine', '1 Stove', '1 Light', '1 AC', '1 Chimney', 'No Bed', 'No Curtains', 'No Dining Table', 'No Fan', 'No Modular Kitchen', 'No Microwave', 'No Fridge', 'No Sofa', 'No TV']",Power Back-up Intercom Facility Lift Swimming Pool Park Piped-gas Fitness Centre  GYM Club house  Community Center Rain Water Harvesting,Y79670437,"3 BHK flat in  Krisumi Waterfall Residences ,  Sector 36A",36
"3 BHK Flatin Sector 102, Gurgaon",https://www.99acres.com/3-bhk-bedroom-apartment-flat-for-sale-in-adani-m2k-oyster-grande-sector-102-gurgaon-1889-sq-ft-r1-spid-J76928915,3.9,  Adani M2K Oyster Grande,2.47,1889.0,,3 Bedrooms,4 Bathrooms,Servant Room,"Adani M2K Oyster Grande Sector 102, Gurgaon",11st   of 24 Floors,North-East,1 to 5 Year Old,The Esplanade Mall Dwarka Express Highway Delhi Public School SGT University The Signature Hospital Indira Gandhi Airport Gurugram Railway Station Nehru Stadium,"This lovely 3 bhk apartment/flat in sector 102 gurgaon is available for sale in one of gurgaon's most popular projects, adani m2k oyster grande. The flat is facing the north-East direction. Constructed on a super built up area of 1889 sq.Ft., the flat comprises 3 bedroom(s), 4 bathrooms and more tha...","['3 Bed', '10 Fan', '1 Exhaust Fan', '3 Geyser', '5 AC', '1 Modular Kitchen', '1 Chimney', 'No Curtains', 'No Dining Table', 'No Light', 'No Microwave', 'No Fridge', 'No Sofa', 'No Stove', 'No TV', 'No Wardrobe', 'No Washing Machine', 'No Water Purifier']",Security  Fire Alarm Power Back-up Feng Shui  Vaastu Compliant Intercom Facility Lift Maintenance Staff Water Storage Separate entry for servant room No open drainage around Recently Renovated Bank Attached Property Visitor Parking Swimming Pool Park Security Personnel Natural Light Low Density Society Shopping Centre Fitness Centre  GYM Waste Disposal Rain Water Harvesting Club house  Community Center Water softening plant,J76928915,"3 BHK flat in  Adani M2K Oyster Grande ,  Sector 102",102
"3 BHK Flatin Sector 112, Gurgaon",https://www.99acres.com/3-bhk-bedroom-apartment-flat-for-sale-in-experion-windchants-sector-112-gurgaon-3763-sq-ft-spid-K79669553,4.0,  Experion Wdchants,5.9,3763.0,2873.18,3 Bedrooms,5 Bathrooms,"Pooja Room,Servant Room","Experion Windchants Sector 112, Gurgaon",18th   of 28 Floors,South,1 to 5 Year Old,Ansal Plaza Dwaraka Expressway First Step Play School Sri Ma Montessori International Jai Sai Ram Hospital Park Hospital IGI Airport Gurgaon Railway Station,"This 3 bhk flat is located in experion windchants, which houses some of the most spacious flats in sector 112 gurgaon. This residential flat is east-Facing direction. Constructed on a super built up area of 3763 sq.Ft., the flat comprises 3 bedroom(s), 5 bathrooms and 2 balconies. The property is lo...","['1 Modular Kitchen', '7 AC', 'No Bed', 'No Chimney', 'No Curtains', 'No Dining Table', 'No Exhaust Fan', 'No Fan', 'No Geyser', 'No Light', 'No Microwave', 'No Fridge', 'No Sofa', 'No Stove', 'No TV', 'No Wardrobe', 'No Washing Machine', 'No Water Purifier']",Power Back-up Feng Shui  Vaastu Compliant Intercom Facility Lift High Ceiling Height Maintenance Staff False Ceiling Lighting Separate entry for servant room No open drainage around Piped-gas Swimming Pool Park Security Personnel Shopping Centre Fitness Centre  GYM Rain Water Harvesting Club house  Community Center Water softening plant,K79669553,"3 BHK flat in  Experion Wdchants ,  Sector 112",112
"3 BHK Flatin Sector 59, Gurgaon",https://www.99acres.com/3-bhk-bedroom-apartment-flat-for-sale-in-conscient-elevate-sector-59-gurgaon-2295-sq-ft-spid-M80560035,,  Conscient Elevate,5.4,2295.0,,3 Bedrooms,4 Bathrooms,"Servant Room,Pooja Room","Conscient Elevate Sector 59, Gurgaon",17th   of 33 Floors,North-East,0 to 1 Year Old,Rapid Metro Station Sector 55 Paras Trinity Mall Sector 63 Badshahpur Sohna Rd Highway Mehrauli-Gurgaon Road DPS International School Sector 50 Gurugram University Sector 51 W Pratiksha Hospital Sector 56 Indira Gandhi International Airport Gurugram Railway Station International Tech Park Gurgaon Grand Hyatt Gurgaon Mannat Park ZEN Golf Range & Academy Tau DeviLal Sports Complex,"Address ; Conscient hines elevate sector 59 , gurgaon , haryana Looking for a 3 bhk property for sale in gurgaon? Buy this 3 bhk flat in conscient elevate that is situated in sector 59 gurgaon. Containing 3 bedroom(s), 4 bathrooms and 3 balconies, this flat is spread over a super built up area of ...","['6 Fan', '4 Geyser', '1 Microwave', '50 Light', '1 Modular Kitchen', '4 AC', '1 Chimney', 'No Bed', 'No Curtains', 'No Dining Table', 'No Exhaust Fan', 'No Fridge', 'No Sofa', 'No Stove', 'No TV', 'No Wardrobe', 'No Washing Machine', 'No Water Purifier']",Water purifier Centrally Air Conditioned Security  Fire Alarm Power Back-up Feng Shui  Vaastu Compliant Private Garden  Terrace Intercom Facility Lift High Ceiling Height Maintenance Staff Water Storage Separate entry for servant room No open drainage around Bank Attached Property Piped-gas Recently Renovated Visitor Parking Swimming Pool Park Security Personnel Natural Light Airy Rooms Spacious Interiors Low Density Society Waste Disposal Rain Water Harvesting Water softening plant Shopping Centre Fitness Centre  GYM Club house  Community Center,M80560035,"3 BHK flat in  Conscient Elevate ,  Sector 59",59
"4 BHK Flatin Sector 3, Gurgaon",https://www.99acres.com/4-bhk-bedroom-apartment-flat-for-sale-in-godrej-habitat-sector-3-gurgaon-2650-sq-ft-spid-G79731583,,  Godrej Habitat,2.45,,2650.0,4 Bedrooms,4 Bathrooms,,"Godrej Habitat Sector 3, Gurgaon",12nd   of 17 Floors,North,0 to 1 Year Old,Huda City Centre Metro Station Star Mall Dwarka Expressway National Highway 8 Gems International School ICFAI University Sneh Hospital Indira Gandhi International Airport Country Inn & Suites by Radisson Appu Ghar Water Park HUDA Mini Golf Course,"Check out this 4 bhk apartment for sale in godrej habitat, a popular residential project that houses in-Demand flats in sector 3 gurgaon. This is a north-Facing property. Containing 4 bedroom(s), 4 bathrooms and more than 3 balconies, this flat is spread over a carpet area of 2650 sq.Ft. The propert...","['1 Wardrobe', '2 Light', '4 AC', 'No Bed', 'No Chimney', 'No Curtains', 'No Dining Table', 'No Exhaust Fan', 'No Fan', 'No Geyser', 'No Modular Kitchen', 'No Microwave', 'No Fridge', 'No Sofa', 'No Stove', 'No TV', 'No Washing Machine', 'No Water Purifier']",Power Back-up Feng Shui  Vaastu Compliant Intercom Facility Lift Swimming Pool Park Piped-gas Fitness Centre  GYM Club house  Community Center,G79731583,"4 BHK flat in  Godrej Habitat ,  Sector 3",3
"3 BHK Flatin Sector 81, Gurgaon",https://www.99acres.com/3-bhk-bedroom-apartment-flat-for-sale-in-bestech-park-view-ananda-sector-81-gurgaon-1660-sq-ft-spid-D79989877,4.1,  Bestech Park View Ananda,1.8,1660.0,1082.0,3 Bedrooms,2 Bathrooms,,"Bestech Park View Ananda Sector 81, Gurgaon",14th   of 15 Floors,West,5 to 10 Year Old,Metro Station Kankrola sec 87 Sapphire 83 Mall Dwarka Expressway St. Xavier's High School Miracles Apollo Cradle /Spectra Hospital Indira Gandhi International Airport IMT Manesar Heritage Village Resort & Spa SkyJumper Trampoline Park National Tennis Academy,"Bestech park view ananda is one of gurgaon's most sought after destination for apartments and this 3 bhk flat in sector 81 gurgaon is your opportunity to be a part of this community. This property faces the west direction. The flat is over 1660 sq.Ft. Super built up area and comes with 3 bedroom(s),...","['5 Fan', '1 Exhaust Fan', '1 Modular Kitchen', '5 AC', 'No Bed', 'No Chimney', 'No Curtains', 'No Dining Table', 'No Geyser', 'No Light', 'No Microwave', 'No Fridge', 'No Sofa', 'No Stove', 'No TV', 'No Wardrobe', 'No Washing Machine', 'No Water Purifier']",Security  Fire Alarm Power Back-up Feng Shui  Vaastu Compliant Intercom Facility Lift Maintenance Staff Water Storage Piped-gas Visitor Parking Swimming Pool Park Security Personnel Shopping Centre Fitness Centre  GYM Rain Water Harvesting Club house  Community Center,D79989877,"3 BHK flat in  Bestech Park View Ananda ,  Sector 81",81
"3 BHK Flatin Sector 84, Gurgaon",https://www.99acres.com/3-bhk-bedroom-apartment-flat-for-sale-in-spaze-kalistaa-sector-84-gurgaon-3200-sq-ft-spid-B80625457,,  Spaze Kalistaa,3.75,,3200.0,3 Bedrooms,4 Bathrooms,"Study Room,Servant Room","Spaze Kalistaa Sector 84, Gurgaon",2nd   of 23 Floors,South,0 to 1 Year Old,"Huda Metro Station Vatika Town Square-INXT Euro International School DPG Degree College Genesis Hospital Indira Gandhi Intl Airport Garhi Harsaru Junction Candor Infospace, Tower 2 Holiday Inn Gurugram Sector 90 AapnoGhar Manesar Golf Course Nakhrola Stadium","This 3 bhk flat is located in spaze kalistaa, which houses some of the most spacious flats in sector 84 gurgaon. The flat is facing the south direction. Constructed on a carpet area of 3200 sq.Ft., the flat comprises 3 bedroom(s), 4 bathrooms and 3 balconies. The residential building has 23 floors i...","['1 Exhaust Fan', '1 Chimney', '1 Modular Kitchen', 'No AC', 'No Bed', 'No Curtains', 'No Dining Table', 'No Fan', 'No Geyser', 'No Light', 'No Microwave', 'No Fridge', 'No Sofa', 'No Stove', 'No TV', 'No Wardrobe', 'No Washing Machine', 'No Water Purifier']",Power Back-up Intercom Facility Lift High Ceiling Height Maintenance Staff False Ceiling Lighting Separate entry for servant room No open drainage around Piped-gas Swimming Pool Park Security Personnel Shopping Centre Fitness Centre  GYM Waste Disposal Rain Water Harvesting Club house  Community Center Water softening plant,B80625457,"3 BHK flat in  Spaze Kalistaa ,  Sector 84",84
"4 BHK Flatin Sector 84, Gurgaon",https://www.99acres.com/4-bhk-bedroom-apartment-flat-for-sale-in-spaze-kalistaa-sector-84-gurgaon-4248-sq-ft-r5-spid-W72436424,,  Spaze Kalistaa,4.65,4248.0,,4 Bedrooms,4 Bathrooms,"Servant Room,Study Room,Pooja Room,Store Room","Spaze Kalistaa Sector 84, Gurgaon",11st   of 23 Floors,North-East,1 to 5 Year Old,"Huda Metro Station Vatika Town Square-INXT Euro International School DPG Degree College Genesis Hospital Indira Gandhi Intl Airport Garhi Harsaru Junction Candor Infospace, Tower 2 Holiday Inn Gurugram Sector 90 AapnoGhar Manesar Golf Course Nakhrola Stadium","Spaze kalistaa is offering a 4bhk apartment in sector 84 gurgaon at a price range of 4.65 cr with an area of 4248 sq.Ft. A ready to move 4 bedroom apartment, located in sector-84, gurgaon, is available. It is a semifurnished apartment, situated in a prominent locality. The apartment is on the 11th f...","['1 Water Purifier', '1 Fridge', '1 Exhaust Fan', '1 Geyser', '1 Stove', '10 Light', '6 AC', '1 Modular Kitchen', '1 Chimney', '3 Wardrobe', '1 Washing Machine', '1 Microwave', 'No Bed', 'No Curtains', 'No Dining Table', 'No Fan', 'No Sofa', 'No TV']",Security  Fire Alarm Intercom Facility Lift Water purifier Maintenance Staff False Ceiling Lighting Water Storage No open drainage around Visitor Parking Swimming Pool Park Security Personnel Natural Light Airy Rooms Spacious Interiors Low Density Society Fitness Centre  GYM Waste Disposal Rain Water Harvesting Club house  Community Center,W72436424,"4 BHK flat in  Spaze Kalistaa ,  Sector 84",84
"3 BHK Flatin Sector 109, Gurgaon",https://www.99acres.com/3-bhk-bedroom-apartment-flat-for-sale-in-ats-kocoon-sector-109-gurgaon-1745-sq-ft-spid-H79747569,4.2,  ATS Kocoon,2.16,1745.0,1550.0,3 Bedrooms,3 Bathrooms,,"ATS Kocoon Sector 109, Gurgaon",15th   of 27 Floors,North-East,1 to 5 Year Old,"Jagdish Super Market Dwarka Euro International School Gyaananda School SCR Model School Radha Krishan Mandir ICICI BANK ATM, Annapurna MKT ESIC Dispensary IGIA Airport Canara Bank New Palam Vihar Gurgaon Gramin Bank Daultabad Stadium Bharat Petroleum Shree Shyam Filling The Club, International City Conscient One",Spacious ready to move 3 bhk apartment of 1745 sqft in ats kocoon available fore sale.,"['3 Wardrobe', '5 Fan', '1 Exhaust Fan', '3 Geyser', '5 Light', '5 AC', '1 Modular Kitchen', '1 Chimney', 'No Bed', 'No Curtains', 'No Dining Table', 'No Microwave', 'No Fridge', 'No Sofa', 'No Stove', 'No TV', 'No Washing Machine', 'No Water Purifier']",Security  Fire Alarm Power Back-up Feng Shui  Vaastu Compliant Intercom Facility Lift Maintenance Staff Water Storage Visitor Parking Swimming Pool Park Shopping Centre Fitness Centre  GYM Club house  Community Center,H79747569,"3 BHK flat in  ATS Kocoon ,  Sector 109",109
"5 BHK Flatin Sector 51, Gurgaon",https://www.99acres.com/5-bhk-bedroom-apartment-flat-for-sale-in-the-citizen-sector-51-gurgaon-5800-sq-ft-spid-X77577983,3.7,  The Citizen,4.95,5800.0,5200.0,5 Bedrooms,5 Bathrooms,"Pooja Room,Study Room","The Citizen Sector 51, Gurgaon",11st   of 11 Floors,North-East,1 to 5 Year Old,Hong Kong Bazaar Mall Radhakrishna Shani Mandir Standard chartered ATM Hdfc bank ATM Standard chartered ATM Hdfc ATM State bank ATM Icici bank ATM Axis bank ATM Vatsalya Clinic Anand Hospital Gurgaon Meher Clinic Kriti Hospital Surgicare Hospital Gurgaon Bones Clinic - Orthopaedics Arihant Hospital Sukhmani Hospital Pvt. Ltd Park Hospital Gurgaon Vishesh Dental Dispencery Neelkanth Health Care pracksht hospital Wembley estate club Pernod Ricard Charitable Dispensary Medisca Unitech Bharat petroleum Heera Fuel Station HCG CNG Station 222 Hdfc bank Hdfc bank and atm Hdfc bank Hdfc bank Madison and Pike Pizza Hut Raj Restaurant Haldiram India Gurugram University Amity Global School St. Angels Sr Kamla International Manav Rachna School Delhi Public School Primary Section St. Angels Jr School of Inspired Leadership SOIL Unitech Business Park Dawnbit Manav Rachna Swimming Pool,"Check out this 5 bhk apartment for sale in the citizen, a popular residential project that houses in-Demand flats in sector 51 gurgaon. Containing 5 bedroom(s), 5 bathrooms and more than 3 balconies, this flat is spread over a super built up area of 5800 sq.Ft. This flat is situated on the top floor...","['1 Water Purifier', '4 Fan', '1 Exhaust Fan', '1 Dining Table', '5 Geyser', '5 Light', '4 AC', '1 Modular Kitchen', '1 Chimney', '1 Curtains', '6 Wardrobe', '1 Sofa', '1 Microwave', 'No Bed', 'No Fridge', 'No Stove', 'No TV', 'No Washing Machine']",Security  Fire Alarm Lift Maintenance Staff Water Storage,X77577983,"5 BHK flat in  The Citizen ,  Sector 51",51
"4 BHK Flatin Sector 84, Gurgaon",https://www.99acres.com/4-bhk-bedroom-apartment-flat-for-sale-in-ss-linden-floors-sector-84-gurgaon-2775-sq-ft-spid-U79474587,,  SS Lden Floors,2.85,,2775.0,4 Bedrooms,4 Bathrooms,Servant Room,"SS Linden Floors Sector 84, Gurgaon",2nd   of 4 Floors,North-East,0 to 1 Year Old,Millennium City Centre Gurugram City Square mall Dwarka Expressway Modern Public School-kherki Daula Agri Business Management Collage Miracles Apollo Cradle Spectra Hospital Indira Gandhi International Airport Gurgaon Railway Station AS Business Park Holiday Inn Gurugram Sector 90 AapnoGhar Manesar Golf Course Nakhrola Stadium,"Check out this 4 bhk apartment for sale in ss linden floors, a popular residential project that houses in-Demand flats in sector 84 gurgaon. The flat is facing the north-East direction. Constructed on a built up area of 2775 sq.Ft., the flat comprises 4 bedroom(s), 4 bathrooms and more than 3 balcon...","['4 Wardrobe', '6 Fan', '1 Exhaust Fan', '5 Geyser', '1 Stove', '14 Light', '5 AC', '1 Modular Kitchen', '1 Chimney', '1 Curtains', 'No Bed', 'No Dining Table', 'No Microwave', 'No Fridge', 'No Sofa', 'No TV', 'No Washing Machine', 'No Water Purifier']",Centrally Air Conditioned Security  Fire Alarm Feng Shui  Vaastu Compliant Private Garden  Terrace Intercom Facility Lift High Ceiling Height False Ceiling Lighting Water Storage Separate entry for servant room No open drainage around Bank Attached Property Piped-gas Internetwi-fi connectivity Recently Renovated Visitor Parking Swimming Pool Park Security Personnel Natural Light Airy Rooms Spacious Interiors Low Density Society Waste Disposal Rain Water Harvesting Water softening plant Shopping Centre Fitness Centre  GYM Club house  Community Center,U79474587,"4 BHK flat in  SS Lden Floors ,  Sector 84",84
"3 BHK Flatin Sector 81, Gurgaon",https://www.99acres.com/3-bhk-bedroom-apartment-flat-for-sale-in-dlf-the-ultima-sector-81-gurgaon-2100-sq-ft-spid-A80107015,4.2,  DLF The Ultima,3.6,2100.0,1900.0,3 Bedrooms,4 Bathrooms,Servant Room,"DLF The Ultima Sector 81, Gurgaon",8th   of 29 Floors,South,1 to 5 Year Old,"Huda Metro Station (Gurugram) Vatika Town Square-INXT Manesar Road NH 48 Euro International School, Sec 84 SGT University Miracles Apollo Cradle Hospital Indira Gandhi Intl Airport Garhi Harsaru Junction","Located in the popular residential address of sector 81 gurgaon, dlf the ultima is one of the most preferred destination for apartments in gurgaon. This 3 bhk flat is your ticket to be a part of this community. This residential flat is west-Facing direction. The flat occupies a super built up area o...","['1 Water Purifier', '6 Fan', '1 Fridge', '1 Exhaust Fan', '4 Geyser', '1 Stove', '7 Light', '1 Chimney', '1 Modular Kitchen', '6 AC', '1 Bed', '10 Wardrobe', '1 Washing Machine', '1 Microwave', 'No Curtains', 'No Dining Table', 'No Sofa', 'No TV']",Security  Fire Alarm Power Back-up Feng Shui  Vaastu Compliant Intercom Facility Lift Maintenance Staff Water Storage Visitor Parking Swimming Pool Park Security Personnel Shopping Centre Fitness Centre  GYM Rain Water Harvesting Club house  Community Center,A80107015,"3 BHK flat in  DLF The Ultima ,  Sector 81",81
